"PSA_1","PSA_2","Article","Web Description","Brand","Capacity","Type","Colour","Pack Qty","Size","Material","DQ Score"
"DIS","BIN","5584640","Inglenook Hearth Cheek Brick","Harewood",NA,"Fire Bricks",NA,NA,"15cmx3.5cmx17cm",NA,0.81
"DIS","BIN","5585940","Inglenook Hearth Brick","Harewood",NA,"Fire Bricks",NA,NA,"3.8cmx23cmx15.5cm",NA,0.81
"DIS","BIN","294490","Inglenook Fireside Shovel Black 5in","Inglenook",NA,"Fireside Tools","Black",NA,"5in",NA,0.93
"DIS","BIN","133869","Supa Stix Firewood Kindling","Wilko",NA,"Logs and Firewood",NA,"1",NA,NA,0.81
"DIS","BIN","1554","Wilko Tie Handle Swing Bin Liners 50L 15pk","Wilko",NA,"Swing Bin Liners",NA,"15","Large",NA,0.883333333333333
"DIS","BIN","214132","Wilko Tie Handle Pedal Bin Liners 25L 30pk","Wilko",NA,"Pedal Bin Liners",NA,"30pk","Large",NA,0.883333333333333
"DIS","BIN","238429","Wilko Tie Top Refuse Sacks 80L 20pk","Wilko",NA,"Refuse Sacks",NA,"30pk","73cmx93cm",NA,0.883333333333333
"DIS","BIN","278076","Wilko Tall Kitchen Bin Liners 30L 20pk","Wilko",NA,"Drawstring Liners",NA,"20pk","30L",NA,0.883333333333333
"DIS","BIN","278077","Wilko Tall Kitchen Bin Liners 50L 15pk","Wilko",NA,"Drawstring Liners",NA,"15pk","50L",NA,0.883333333333333
"DIS","BIN","330867","Wilko Tie Handle Garden Refuse Sacks 80L 10pk","Wilko",NA,"Refuse Sacks",NA,"10pk","80L",NA,0.883333333333333
"DIS","BIN","330868","Wilko Wheelie Bin Liners 120 x 240L 10pk","Wilko",NA,"Wheelie Bin Liners",NA,"10pk","80L",NA,0.883333333333333
"DIS","BIN","332574","Wilko Recycled Refuse Bags Large 100L 20pk","Wilko",NA,"Refuse Sacks",NA,"20pk","Large",NA,0.883333333333333
"DIS","BIN","332590","Wilko Recycled Refuse Bags Large 90L 10pk","Wilko",NA,"Refuse Sacks",NA,"10pk","Large",NA,0.883333333333333
"DIS","BIN","332591","Wilko Recycled Bin Bags Extra Large 120L 20pk","Wilko",NA,"Refuse Sacks",NA,"20pk","Extra Large",NA,0.883333333333333
"DIS","BIN","333513","Wilko Recycled Swing Bin Liners 50L 20pk","Wilko",NA,"Swing Bin Liners",NA,"20pk","50L",NA,0.883333333333333
"DIS","BIN","400384","Wilko Home Compost Caddy Liner 20pk","Wilko",NA,"Refuse Sacks",NA,NA,NA,NA,0.766666666666667
"DIS","BIN","400385","Wilko Industrial Compost Caddy Liner 20pk","Wilko",NA,"Refuse Sacks",NA,"20",NA,NA,0.825
"DIS","BIN","400391","Wilko Extra Strong Rubble Sacks 10pk","Wilko",NA,"Refuse Sacks",NA,"1","10 Pack",NA,0.883333333333333
"DIS","BIN","400392","Wilko Refuse Sacks Clear 20pk","Wilko",NA,"Refuse Sacks",NA,"20pk",NA,NA,0.825
"DIS","BIN","400393","Wilko Drawstring Storage Bag Clear 10pk","Wilko",NA,"Storage Bags",NA,"10","90L",NA,0.883333333333333
"DIS","BIN","400394","Wilko Kerbside Caddy Liners Large 10pk","Wilko",NA,"Refuse Sacks",NA,"10",NA,NA,0.825
"DIS","BIN","400395","Wilko Waste Basket Liners Lavender Scented 25pk","Wilko",NA,"Swing Bin Liners",NA,"25",NA,NA,0.825
"DIS","BIN","420095","Wilko Firelighters 28pk","Wilko",NA,"Firelighters",NA,"2","2 tablets, each of 120x16x188mm, individually wrap",NA,0.93
"DIS","BIN","420096","Wilko Wrapped Firelighters 18pk","Wilko",NA,"Firelighters",NA,NA,NA,NA,0.79
"DIS","BIN","420097","Wilko Firelog 800g","Wilko",NA,"Firelogs",NA,NA,NA,NA,0.79
"DIS","BIN","5574440","Wilko Firelighters 14pk","Wilko",NA,"Firelighters",NA,"14pk",NA,NA,0.86
"DIS","BIN","63855","Wilko Drawstring Refuse Sacks 80L 10pk","Wilko",NA,"Refuse Sacks",NA,"10pk","Large",NA,0.883333333333333
"DIS","BIN","63857","Wilko Drawstring Swing Bin Liners 50L 15pk","Wilko",NA,"Swing Bin Liners",NA,"15","Large",NA,0.883333333333333
"DIS","BIN","71844","Wilko Tie Handle Refuse Sacks Black 80L 10pk","Wilko",NA,"Refuse Sacks",NA,"10","Large",NA,0.883333333333333
"DIS","BIN","193718","Wilko Swing Bin Liners 58 x76cm 50pk","Wilko Functional",NA,"Swing Bin Liners",NA,"50pk","585mmx760mm",NA,0.833333333333333
"DIS","BIN","332570","Wilko Functional Refuse Sacks 30pk","Wilko Functional",NA,"Refuse Sacks",NA,"30",NA,NA,0.825
"DIS","BIN","332690","Wilko Functional Pedal Bin Liners 50pk","Wilko Functional",NA,"Pedal Bin Liners",NA,"50pk","46cmx46cm",NA,0.883333333333333
"DIS","BIN","313209","Zip Energy Firelighters 24pk","Zip",NA,"Firelighters",NA,"24pk",NA,NA,0.86
"DIS","BIN","345294","Zip Firelighter Cubes Wrapped 16pk","Zip",NA,"Firelighters","Multi",NA,NA,NA,0.86
"DIS","BIN","409072","Zip Soot Reducer 10 Sachets","Zip",NA,"Soot Reducers",NA,"10",NA,NA,0.86
"DIS","FOO","185737","Bacofoil Non-Stick Kitchen Foil 5m","Baco",NA,"Aluminium Foil",NA,"1","300mmx5m",NA,0.85
"DIS","FOO","431279","Bacofoil Non Stick Kitchen Foil 5m x 450mm","Baco",NA,"Greaseproof Paper",NA,"1","5m",NA,0.85
"DIS","FOO","431280","Bacofoil Non Stick Baking Paper 10m x 380mm","Baco",NA,"Greaseproof Paper",NA,"1","10m",NA,0.85
"DIS","FOO","431281","Bacofoil 2 in 1 Parchment and Foil 5m x 380mm","Baco",NA,"Greaseproof Paper",NA,"1","5m",NA,0.85
"DIS","FOO","431282","Bacofoil Foil Sandwich Bags Large 16pk","Baco",NA,"Food Bags",NA,"16","Large",NA,0.85
"DIS","FOO","71845","Bacofoil Resealable Food Bags Medium 50pk","Baco",NA,"Food Bags",NA,"50pk",NA,NA,0.8
"DIS","FOO","238374","Wilko Multi Purpose Roasting Bags 25 x 38cm 10pk","Polylina",NA,"Roasting Bags",NA,"10pk","250mmx380mm",NA,0.8
"DIS","FOO","203971","Wilko Foil Flan Cases 10pk","Wilko",NA,"Flan Cases",NA,"10pk",NA,"Aluminium",0.85
"DIS","FOO","203974","Wilko Pie Dishes Aluminium Small 20pk","Wilko",NA,"Pie Dishes",NA,"20pk","Small","Aluminium",0.9
"DIS","FOO","203975","Wilko Pie Plates Aluminium 6pk","Wilko",NA,"Pie Dishes",NA,"6pk",NA,"Aluminium",0.85
"DIS","FOO","203976","Wilko Foil Trays and Lids Small 10pk","Wilko",NA,"Foil Trays",NA,"10pk","Small","Aluminium",0.9
"DIS","FOO","203977","Wilko Trays and Lids Foil Medium 5pk","Wilko",NA,"Foil Trays",NA,"5pk","Medium","Aluminium",0.9
"DIS","FOO","203978","Wilko Foil Trays Large 3pk","Wilko",NA,"Foil Trays",NA,"3pk","Large","Aluminium",0.9
"DIS","FOO","203979","Wilko Food Containers and Lids 6pk","Wilko",NA,"Plastic Containers",NA,"6pk",NA,NA,0.8
"DIS","FOO","254700","Wilko Ice Cube Bags 20pk","Wilko",NA,"Ice Cube Bags",NA,"20pk","24","Plastic",0.9
"DIS","FOO","284667","Wilko Food and Freezer Bags Large 30pk","Wilko",NA,"Food Bags",NA,"30pk","Large","Polythene",0.9
"DIS","FOO","285716","Wilko Foil Roasting Trays 2pk","Wilko",NA,"Foil Trays",NA,"2pk",NA,"Aluminium",0.85
"DIS","FOO","318975","Wilko Kitchen Foil 10m x 30cm","Wilko",NA,"Aluminium Foil",NA,NA,"300mmx10m",NA,0.8
"DIS","FOO","318976","Wilko Kitchen Foil 20m x 30cm","Wilko",NA,"Aluminium Foil",NA,NA,"300mmx20m",NA,0.8
"DIS","FOO","318977","Wilko Kitchen Foil 10m x 45cm","Wilko",NA,"Aluminium Foil",NA,NA,"450mmx10m",NA,0.8
"DIS","FOO","330841","Wilko Resealable Food and Freezer Bags  26 x 28cm30pk","Wilko",NA,"Food Bags",NA,"30pk","Medium",NA,0.85
"DIS","FOO","330844","Wilko  Zip Seal Food and Freezer Bags 26 x26cm30pk","Wilko",NA,"Food Bags",NA,"30pk","Medium",NA,0.85
"DIS","FOO","330856","Wilko Tie Handle Food and Freezer BagsMedium 26 x 42cm 30pk","Wilko",NA,"Food Bags",NA,"30pk","Medium","Polythene",0.9
"DIS","FOO","330857","Wilko Resealable Food and Freezer Bags 18 x20cm30pk","Wilko",NA,"Food Bags",NA,"1","Small",NA,0.85
"DIS","FOO","330862","Wilko Easy Seal Sandwich Bags 19 x 21cm 60pk","Wilko",NA,"Food Bags",NA,"60pk","Large","Polythene",0.9
"DIS","FOO","330864","Wilko Resealable Pour and Store Bags 23 x 15cm10pk","Wilko",NA,"Food Bags",NA,"10pk","23cmx15cm",NA,0.85
"DIS","FOO","333063","Wilko Aluminium Tray Bakes Small 3pk","Wilko",NA,"Foil Trays",NA,"3pk","Small","Aluminium",0.9
"DIS","FOO","333067","Wilko Aluminium Flan Dishes Large 6pk","Wilko",NA,"Flan Cases",NA,"6pk","Large","Aluminium",0.9
"DIS","FOO","333068","Wilko Aluminium Containers with Lids Large 3pk","Wilko",NA,"Foil Trays",NA,"3pk","Large","Aluminium",0.9
"DIS","FOO","333417","Wilko Greaseproof n Bake Paper 5m x 37.5cm","Wilko",NA,"Greaseproof Paper",NA,NA,"5m","Paper",0.85
"DIS","FOO","333522","Wilko Foil Backed Baking Parchment Foil Backed5m x 30cm","Wilko",NA,"Aluminium Foil",NA,NA,"300mmx5m",NA,0.8
"DIS","FOO","400397","Wilko Multipurpose Cling Film 50m x 350mm","Wilko",NA,"Cling Film",NA,"1","50m x 350mm",NA,0.85
"DIS","FOO","419994","Wilko Plastic Containers and Lids 6pk","Wilko",NA,"Plastic Containers",NA,NA,NA,NA,0.75
"DIS","FOO","420106","Wilko Food Bags Small 150pk","Wilko",NA,"Food Bags",NA,"150",NA,NA,0.8
"DIS","FOO","318979","Wilko Functional Wrapping Foil 20m x 29cm","Wilko Functional",NA,"Aluminium Foil",NA,"1","290mmx20m",NA,0.85
"DIS","FOO","332334","Wilko Functional Food Bags Medium 23 x 35cm 50pk","Wilko Functional",NA,"Food Bags",NA,"50pk","Medium",NA,0.85
"DIS","FOO","334768","Wilko Functional Wrapping Film 50m x 30cm","Wilko Functional",NA,"Cling Film",NA,NA,"50mx300ml",NA,0.8
"DIS","TAB","419990","Paloma Disposable Napkins Spots 20pk","Paloma",NA,"Napkins",NA,"20pk","33x33cm",NA,0.93
"DIS","TAB","150005","Wilko Insulated Bowls White 10pk","Wilko",NA,"Plates and Bowls","White","10pk",NA,NA,0.93
"DIS","TAB","203993","Wilko Drinking Straws Neon 200pk","Wilko",NA,"Straws","Multi","200pk",NA,NA,0.93
"DIS","TAB","298761","Muffin Cases Multi Coloured 48pk","Wilko",NA,"Cake Cases","Multi","48pk",NA,NA,0.8
"DIS","TAB","331992","Wilko Paper Plates Small White 30pk","Wilko",NA,"Plates and Bowls",NA,"30pk","Small",NA,0.93
"DIS","TAB","332569","Wilko Paper Plates Red 20pk","Wilko",NA,"Plates and Bowls","Red","20pk",NA,NA,0.93
"DIS","TAB","332589","Wilko Paper Plates Cream 20pk","Wilko",NA,"Plates and Bowls","Cream","20pk",NA,NA,0.93
"DIS","TAB","332641","Wilko Insulated Cups Small White 10pk","Wilko",NA,"Cups",NA,"10pk","Small",NA,0.93
"DIS","TAB","333427","Wilko Disposable Teaspoons Clear 30pk","Wilko",NA,"Cutlery","Clear","30pk",NA,NA,0.93
"DIS","TAB","333428","Wilko  Disposable Knives Clear 30pk","Wilko",NA,"Cutlery","Clear","30pk",NA,NA,0.93
"DIS","TAB","333430","Wilko Disposable Forks Clear 30pk","Wilko",NA,"Cutlery","Clear","30pk",NA,NA,0.93
"DIS","TAB","333431","Wilko Disposable Dessert Spoons Clear 30pk","Wilko",NA,"Cutlery","Clear","30pk",NA,NA,0.93
"DIS","TAB","333432","Wilko Party Cutlery Set Clear  Knives Forks andSpoons 10 Sets","Wilko",NA,"Cutlery","Clear","30pk",NA,NA,0.93
"DIS","TAB","333446","Wilko Disposable Wine Glasses Clear 10pk","Wilko",NA,"Glasses","Clear","10pk",NA,NA,0.93
"DIS","TAB","334087","Wilko Plastic Plates Clear 10pk","Wilko",NA,"Plates and Bowls","Clear","10pk",NA,NA,0.93
"DIS","TAB","419988","Wilko Disposable Red Cups 10pk","Wilko",NA,"Cups",NA,"10pk",NA,NA,0.86
"DIS","TAB","419992","Wilko Disposable Plates Spots 20pk","Wilko",NA,"Plates and Bowls",NA,NA,NA,NA,0.79
"DIS","TAB","419995","Wilko Shot Glasses 16pk","Wilko",NA,"Shot Glasses",NA,"16",NA,NA,0.86
"DIS","TAB","797540","Wilko Wooden Cocktail Sticks 100pk","Wilko",NA,"Cocktail Sticks","Brown","1","100 Pack",NA,0.9
"DIS","TAB","203985","Wilko Functional Paper Tablecovers White 90 x90cm 4pk","Wilko Functional",NA,"Tablecloth",NA,"4pk","90cmx90cm",NA,0.93
"DIS","TAB","331993","Wilko Functional Plastic Cups White 30pk","Wilko Functional",NA,"Cups",NA,"30pk","Small",NA,0.93
"DIS","TAB","63821","Wilko Functional Napkins 1 Ply White 100pk","Wilko Functional",NA,"Napkins",NA,"100pk","1ply",NA,0.93
"DIS","TIS","410247","Kleenex Original Tissues Pocket Pack 8pk","Kleenex",NA,"Facial Tissues",NA,"8pk",NA,NA,0.9125
"DIS","TIS","301930","Velvet Facial Tissue Box 80 Sheets 3 Ply","Velvet",NA,"Facial Tissues",NA,NA,"Family",NA,0.9125
"DIS","TIS","351803","Wilko Ultra Soft Balm Tissues 80 Sheets 3 Ply","Wilko",NA,"Facial Tissues",NA,"1",NA,NA,0.9125
"DIS","TIS","351805","Wilko Super Soft Tissues Cube 56 Sheets 3 Ply","Wilko",NA,"Facial Tissues",NA,NA,"60s",NA,0.9125
"DIS","TOI","333517","Wilko Toilet Wipes Clean and Fresh 42pk","Wilko",NA,"Moist Wipes",NA,"1",NA,NA,0.9125
"DIS","TOI","351810","Wilko Functional Toilet Tissues White 6 Rolls190 Sheets 2 Ply","Wilko Functional",NA,"Toilet Roll",NA,"6",NA,NA,0.9125
"DIS","TOW","422452","Wilko Ultra Household Towel Extra LargeSingle Roll 3 Ply","Wilko",NA,"Kitchen Towels",NA,"1",NA,NA,0.9125
"DIS","TOW","435080","Wilko Ultra Household Towel2 Rolls 3 Ply","Wilko",NA,"Kitchen Towels",NA,"2",NA,NA,0.9125
