"PSA_1","PSA_2","Article","Web Description","Brand","Size","Colour","Pack Qty","Material","Assembly","Power","Capacity","Model Number","DQ Score"
"HOU","MOP","456351","Wilko Microfibre Window Cleaning Sponge","Wilko",NA,NA,"1",NA,NA,NA,NA,NA,0.9125
"HOU","MOP","456352","Wilko Window Wiper with Cleaning Cloth","Wilko",NA,NA,"1",NA,NA,NA,NA,NA,0.9125
"HOU","MOP","456353","Wilko Window Wiper 355mm","Wilko","355mm",NA,"1",NA,NA,NA,NA,NA,1
"HOU","MOP","65818","Wilko Galvanised Mop Bucket Silver","Wilko","13L","Silver","1",NA,NA,NA,NA,NA,0.941666666666667
"HOU","MOP","66135","Wilko Traditional Sink Plunger Large","Wilko","Large","Multi","1",NA,NA,NA,NA,NA,0.941666666666667
"HOU","MOP","98352","Wilko Plunger Hand Grip Sink Black/White","Wilko","Small","Multi","1",NA,NA,NA,NA,NA,0.941666666666667
"HOU","MOP","191511","Wilko Tough Scrubbing Brush Assorted","Wilko Functional","Small","Multi","1",NA,NA,NA,NA,NA,0.891666666666667
"HOU","PEG","132982","Wilko 20 Peg Airer","Wilko",NA,"Multi","20pcs",NA,NA,NA,NA,NA,0.93
"HOU","PEG","226662","Wilko Retractable Clothes Line 12m","Wilko","12m","White","1",NA,NA,NA,NA,NA,1
"HOU","PEG","267261","Wilko Shower Resistant Peg Bag 38 x 28cm","Wilko","38cmx28cm","Multi","1pcs",NA,NA,NA,NA,NA,1
"HOU","PEG","300155","Wilko Steel Clothes Line 20m","Wilko","20m","Silver","1",NA,NA,NA,NA,NA,1
"HOU","PEG","300156","Wilko Retractable Clothes Line Heavy Duty 15m","Wilko","15m","Green","1",NA,NA,NA,NA,NA,1
"HOU","PEG","300158","Wilko Soft Grip Pegs Large 24pk","Wilko","Large","Multi","24pk",NA,NA,NA,NA,NA,1
"HOU","PEG","300160","Wilko Heavy Duty Pegs Multicoloured 36pk","Wilko","Heavy Duty","Multi","36pk",NA,NA,NA,NA,NA,1
"HOU","PEG","300163","Wilko Peg Basket with Soft Grip Pegs 50pk","Wilko",NA,"Multi","50pk",NA,NA,NA,NA,NA,0.93
"HOU","PEG","327972","Wilko Snapper Pegs Multicoloured 36pk","Wilko",NA,"Multi","36pk",NA,NA,NA,NA,NA,0.93
"HOU","PEG","327979","Wilko Peg Bag","Wilko",NA,"Multi","1pcs",NA,NA,NA,NA,NA,0.93
"HOU","PEG","328210","Wilko Lingerie Washing Bag White","Wilko",NA,"White","1",NA,NA,NA,NA,NA,0.93
"HOU","PEG","328211","Wilko Delicates Washing Bag White","Wilko",NA,"Black","1",NA,NA,NA,NA,NA,0.93
"HOU","PEG","454057","Wilko Premium Pegs 20 Pack","Wilko",NA,NA,"20 Pack","Polypropylene. Therrmoplastic Rubber","No",NA,NA,NA,0.65
"HOU","PEG","328212","Wilko Functional Wooden Peg 36pk","Wilko Functional",NA,"Cream","36pk",NA,NA,NA,NA,NA,0.93
"HOU","SCO","65682","Brillo Mr Muscle Multi-Use Soap Pads 10pk","Brillo",NA,"Silver","10pk",NA,NA,NA,NA,NA,0.93
"HOU","SCO","300101","Dishmatic Dish Sponge Refill Non Scratch 2pk","Dish Matic",NA,"Multi","1",NA,NA,NA,NA,NA,0.88
"HOU","SCO","300102","Dishmatic Dish Scourer Fill and Clean","Dish Matic",NA,"Multi","1",NA,NA,NA,NA,NA,0.88
"HOU","SCO","300103","Dishmatic Dish Sponge Heavy Duty Refill 2pk","Dish Matic","Heavy Duty","Multi",NA,NA,NA,NA,NA,NA,0.88
"HOU","SCO","328266","Dishmatic Fill and Clean Washing Up Brush","Dish Matic",NA,"Multi","1",NA,NA,NA,NA,NA,0.88
"HOU","SCO","427442","Fairy Cleaning Sponge 3in1 Green","Fairy",NA,NA,"2 Pack",NA,NA,NA,NA,NA,0.86
"HOU","SCO","427443","Fairy Cleaning Sponge 3in1 Blue","Fairy",NA,NA,"2 Pack",NA,NA,NA,NA,NA,0.86
"HOU","SCO","427444","Fairy Inox Scourer Ball 3pk","Fairy",NA,NA,NA,NA,NA,NA,NA,NA,0.79
"HOU","SCO","436453","Fairy Platinum Sponge 2pk","Fairy",NA,"Silver","2",NA,NA,NA,NA,NA,0.93
"HOU","SCO","436454","Fairy Multi-Purpose Microfibre Cloth","Fairy",NA,"Green","1",NA,NA,NA,NA,NA,0.93
"HOU","SCO","436455","Fairy Sponge Cloths 3pk","Fairy",NA,"Multi","3",NA,NA,NA,NA,NA,0.93
"HOU","SCO","453871","Fairy Hygienic Scourer Original 2pk","Fairy",NA,NA,"2 Pack",NA,NA,NA,NA,NA,0.86
"HOU","SCO","453872","Fairy Hygienic Scourer Platinum 2pk","Fairy",NA,NA,"2 Pack",NA,NA,NA,NA,NA,0.86
"HOU","SCO","453873","Fairy Hygienic Scourer Delicate 2pk","Fairy",NA,NA,"2",NA,NA,NA,NA,NA,0.86
"HOU","SCO","453874","Fairy Multi Purpose Scourer 4pk","Fairy",NA,NA,"4",NA,NA,NA,NA,NA,0.86
"HOU","SCO","453875","Fairy Scouring Pad Platinum 3pk","Fairy",NA,NA,"3",NA,NA,NA,NA,NA,0.86
"HOU","SCO","453876","Fairy Wiping Pad 3pk","Fairy",NA,NA,"3",NA,NA,NA,NA,NA,0.86
"HOU","SCO","229175","Marigold Extra Life Kitchen Gloves Large","Marigold","Large","Yellow","2pcs",NA,NA,NA,NA,NA,1
"HOU","SCO","229176","Marigold Extra Life Kitchen Gloves Medium","Marigold","Medium","Yellow","2pcs",NA,NA,NA,NA,NA,1
"HOU","SCO","229178","Marigold Longer Bathroom Gloves Medium","Marigold","Medium","Yellow","2pcs",NA,NA,NA,NA,NA,1
"HOU","SCO","351848","Marigold Extra Life Kitchen Glove Small","Marigold","Small","Yellow","1",NA,NA,NA,NA,NA,1
"HOU","SCO","351849","Marigold Sensitive Gloves Medium","Marigold",NA,"Multi","1",NA,NA,NA,NA,NA,0.93
"HOU","SCO","417429","Marigold Extra Tough Outdoor Gloves Large","Marigold",NA,"Black","1",NA,NA,NA,NA,NA,0.93
"HOU","SCO","432735","Marigold Wash and Wipe Dish Cloth 2pk","Marigold","36 x 36cm","White","2",NA,NA,NA,NA,NA,1
"HOU","SCO","432736","Marigold Wiper Upper 2pk","Marigold","34 x 34cm","Yellow","2",NA,NA,NA,NA,NA,1
"HOU","SCO","432737","Marigold Squeaky Clean","Marigold","29 x 29cm","Purple","1",NA,NA,NA,NA,NA,1
"HOU","SCO","432738","Marigold Let It Shine Microfibre Cloths 4pk","Marigold","30 x 30cm","Multi","4",NA,NA,NA,NA,NA,1
"HOU","SCO","432739","Marigold Oops Away All Purpose Cloths 6pk","Marigold","35 x 45cm","Pink","6",NA,NA,NA,NA,NA,1
"HOU","SCO","432741","Marigold No More Elbow Grease Stainless Steel Pad","Marigold",NA,"Grey","1",NA,NA,NA,NA,NA,0.93
"HOU","SCO","432742","Marigold Scrunchie 3pk","Marigold","6.5 x 2 x 6.5cm","Grey","3",NA,NA,NA,NA,NA,1
"HOU","SCO","432743","Marigold Clean and Gleam 2pk","Marigold","6.8 x 4.3 x 9cm","Green","2",NA,NA,NA,NA,NA,1
"HOU","SCO","432745","Marigold Cleaning Me Softly 2pk","Marigold","11 x 6 x 2.3cm","Green","2",NA,NA,NA,NA,NA,1
"HOU","SCO","283974","No More Chemicals Window Cloth","No More Chemicals",NA,"Yellow","1",NA,NA,NA,NA,NA,0.93
"HOU","SCO","283975","No More Chemicals Bathroom Cloth Blue","No More Chemicals",NA,"Blue","1pcs",NA,NA,NA,NA,NA,0.93
"HOU","SCO","448579","Protector Household Gloves Medium","Protector","Medium","Yellow","1",NA,NA,NA,NA,NA,1
"HOU","SCO","417431","Marigold Latex Free Disposable Gloves 40pk","Vileda",NA,NA,NA,NA,NA,NA,NA,NA,0.74
"HOU","SCO","1173440","Wilko Bottle Brush","Wilko",NA,"Multi",NA,NA,NA,NA,NA,NA,0.86
"HOU","SCO","132470","Wilko Dish Cloth Roll 8pk","Wilko","30cmx25cm","White","8pk",NA,NA,NA,NA,NA,1
"HOU","SCO","1348340","Wilko All Purpose Cloths 60 x 33cm 10pk","Wilko","60cmx33cm","Multi","10pk",NA,NA,NA,NA,NA,1
"HOU","SCO","157418","Wilko Chamois Cloth Synthetic 40 x 36cm","Wilko","40x36cm","Yellow","1",NA,NA,NA,NA,NA,1
"HOU","SCO","157429","Wilko Dish Cloths Roll Large 4pk","Wilko","Extra Large","Multi","4pk",NA,NA,NA,NA,NA,1
"HOU","SCO","157430","Wilko Yellow Dusters Large 4pk","Wilko","50x40cm","Yellow","4pk","Mixed Fibre",NA,NA,NA,NA,1
"HOU","SCO","157517","Wilko Bathroom Cleaning Sponge 2pk","Wilko",NA,"Multi","2pk",NA,NA,NA,NA,NA,0.93
"HOU","SCO","178481","Wilko All Purpose Cloths 30pk","Wilko","60x30cm","Multi","30pk",NA,NA,NA,NA,NA,1
"HOU","SCO","178483","Wilko Stainless Steel Scourers 6pk","Wilko",NA,"Metal","6pk",NA,NA,NA,NA,NA,0.93
"HOU","SCO","178485","Wilko Sponge Scourers Assorted 20pk","Wilko",NA,"Multi","20pk",NA,NA,NA,NA,NA,0.93
"HOU","SCO","178490","Wilko Cellulose Sponge Cloth 4pk","Wilko",NA,"Multi","4pk",NA,NA,NA,NA,NA,0.93
"HOU","SCO","178493","Wilko All Purpose Silver Scourers 3pk","Wilko","26x13cm","Silver","3pk",NA,NA,NA,NA,NA,1
"HOU","SCO","204899","Wilko Microfibre Cloths 3pk","Wilko","16x20cm","Multi","3pk",NA,NA,NA,NA,NA,1
"HOU","SCO","229174","Wilko Antibacterial All Purpose Cloths 10pk","Wilko","60x33cm","Multi","10pk",NA,NA,NA,NA,NA,1
"HOU","SCO","269768","Wilko Antibacterial Washing Pad 4pk","Wilko",NA,"Multi","4pk",NA,NA,NA,NA,NA,0.93
"HOU","SCO","269779","Wilko SuperKnit Dish Cloths 6pk","Wilko","35x30cm",NA,"6pk",NA,NA,NA,NA,NA,0.93
"HOU","SCO","269791","Wilko Plastic Pan Scourers Multi Coloured 6pk","Wilko",NA,"Multi","6pk",NA,NA,NA,NA,NA,0.93
"HOU","SCO","269792","Wilko Cellulose Sponge Wipes Assorted 4pk","Wilko",NA,"Multi","4pk",NA,NA,NA,NA,NA,0.93
"HOU","SCO","269796","Wilko Absorbent Multi Purpose Cloths MultiColoured 10pk","Wilko","38x30cm","Multi","10pk",NA,NA,NA,NA,NA,1
"HOU","SCO","300096","Wilko Pearl Scourers Assorted 2pk","Wilko","12cmx9cm","Yellow","2pk",NA,NA,NA,NA,NA,1
"HOU","SCO","300122","Wilko Blind Cleaner and Refills Black and Grey","Wilko",NA,"Purple",NA,"Polyester, Polyamide",NA,NA,NA,NA,0.883333333333333
"HOU","SCO","300123","Wilko Microfibre Duster with Handle","Wilko",NA,"Multi","1","Polyester",NA,NA,NA,NA,0.941666666666667
"HOU","SCO","300124","Wilko Telescopic Duster White","Wilko",NA,"White","1","Polyester",NA,NA,NA,NA,0.941666666666667
"HOU","SCO","300125","Wilko Telescopic Duster Refill White 4pk","Wilko",NA,"White","4pk","Polyester",NA,NA,NA,NA,0.941666666666667
"HOU","SCO","300127","Wilko Microfibre Cloths Glass Clean System 2pk","Wilko","35x35cm",NA,"2pk",NA,NA,NA,NA,NA,1
"HOU","SCO","328243","Wilko Extra Wear Rubber Gloves Medium Yellow","Wilko","Medium",NA,"1",NA,NA,NA,NA,NA,0.93
"HOU","SCO","328244","Wilko  Extra Wear Rubber Gloves Large Yellow","Wilko","Large","Yellow","1",NA,NA,NA,NA,NA,1
"HOU","SCO","328263","Wilko Microfibre Cloth Pink and White","Wilko","40cmx40cm","Multi","1",NA,NA,NA,NA,NA,1
"HOU","SCO","328272","Wilko Glass Cleaning Microfibre Cloth Blue 60 x80cm","Wilko","60cmx80cm","Blue","1",NA,NA,NA,NA,NA,1
"HOU","SCO","328279","Wilko Ribbed Dish Cloths 35 x 26cm 4pk","Wilko","35cmx26cm","Multi","4pk",NA,NA,NA,NA,NA,1
"HOU","SCO","328280","Wilko Microfibre Dish Cloths 30 x 30cm 3pk","Wilko","30cmx30cm","Multi","3pk",NA,NA,NA,NA,NA,1
"HOU","SCO","351286","Wilko Feather Duster","Wilko",NA,"Purple","1",NA,NA,NA,NA,NA,0.883333333333333
"HOU","SCO","351287","Wilko Hand Grip Sponge Scourers 10pk","Wilko",NA,"Green","10pk",NA,NA,NA,NA,NA,0.93
"HOU","SCO","351288","Wilko Hand Grip Non Scratch Scourers 10pk","Wilko",NA,"Multi","10pk",NA,NA,NA,NA,NA,0.93
"HOU","SCO","351290","Wilko Scouring Pads 6pk","Wilko",NA,"Green","6pk",NA,NA,NA,NA,NA,0.93
"HOU","SCO","351858","Wilko Dish Brush Caddy","Wilko",NA,"White","1",NA,NA,NA,NA,NA,0.93
"HOU","SCO","417127","Wilko Striped Microfibre Cloths 2pk","Wilko",NA,NA,NA,NA,NA,NA,NA,NA,0.79
"HOU","SCO","454080","Wilko Latex Free Vinyl Disposable Gloves 30pk","Wilko",NA,NA,"30",NA,NA,NA,NA,NA,0.86
"HOU","SCO","454081","Wilko Natural Rubber Latex Disposable Gloves 30pk","Wilko",NA,NA,"30",NA,NA,NA,NA,NA,0.86
"HOU","SCO","78077","Wilko Sponge Scourers Assorted 6pk","Wilko",NA,"Multi","6pk",NA,NA,NA,NA,NA,0.93
"HOU","SCO","82974","Wilko Heavy Duty Rubber Gloves Medium","Wilko","Medium","Yellow","1",NA,NA,NA,NA,NA,1
"HOU","SCO","82975","Wilko Heavy Duty rubber Gloves Large","Wilko","Large","Yellow","1",NA,NA,NA,NA,NA,1
"HOU","SCO","87681","Wilko Gloves Washing Up Latex Rubber Pink/Yellow Small","Wilko","Small","Yellow",NA,NA,NA,NA,NA,NA,0.93
"HOU","SCO","87682","Wilko Gloves Washing Up Rubber Medium","Wilko","Medium","Yellow",NA,NA,NA,NA,NA,NA,0.93
"HOU","SCO","87683","Wilko Wash Up Rubber Gloves Large","Wilko","Large","Yellow",NA,NA,NA,NA,NA,NA,0.93
"HOU","SCO","1174340","Wilko Functional Dish Brush","Wilko Functional",NA,"Multi","1",NA,NA,NA,NA,NA,0.93
"HOU","SCO","269238","Wilko Functional Rubber Gloves One Size 2pk","Wilko Functional","Medium","Multi","2pk",NA,NA,NA,NA,NA,1
"HOU","SPC","420159","Vileda Hot Spray Mop 100 Degrees","Vileda","Vileda Hot Spray 1290mm (H) x 350mm (W) x 260mm (D",NA,"1","Plastic",NA,NA,NA,NA,0.941666666666667
"HOU","SPC","420160","Vileda 100 Degrees Hot Spray Refills","Vileda","Vileda Hot Spray Refill 4mm (H) x 320mm (W) x 235m",NA,"2","Microfibre",NA,NA,NA,NA,0.941666666666667
"HOU","SPC","425196","Vileda Windowmatic Window Vacuum","Vileda",NA,NA,"1",NA,NA,NA,NA,NA,0.9125
"HOU","SPC","351863","Wilko 3 Tier Airer Red","Wilko",NA,"Red","1",NA,NA,NA,NA,NA,0.93
"HOU","SPC","351864","Wilko 3 Tier Airer Teal","Wilko",NA,"Green","1",NA,NA,NA,NA,NA,0.93
"HOU","SPC","351865","Wilko 3 Tier Airer Purple","Wilko",NA,"Purple","1",NA,NA,NA,NA,NA,0.93
"HOU","SWE","436780","Addis Multi Surface Sweeper","Addis",NA,NA,"1",NA,NA,NA,NA,NA,0.825
"HOU","SWE","429071","Black and Decker Flexi Dustbuster Cordless HandHeld Vacuum Cleaner 10.8v","Black & Decker","(H)25.0 x (W)30.0 x (D)16.0",NA,NA,NA,NA,NA,NA,"PD1020L-GB",0.833333333333333
"HOU","SWE","454070","Black & Decker Dustbuster Cordless Hand VacuumCleaner 5.4wh Lithium Ion 3.6V","Black & Decker",NA,NA,NA,NA,NA,"7.5 air watts 3.6v Li-Ion",NA,"NVB115W-GB",0.833333333333333
"HOU","SWE","454071","Black & Decker Dustbuster Cordless Bagless HandVacuum Wet and Dry Lithium Ion 7.2V","Black & Decker",NA,NA,NA,NA,NA,"7.2v",NA,"WDB215WA-GB",0.833333333333333
"HOU","SWE","454072","Black & Decker Stick Vac 2 in 1 28.8wh EPP 14.4V","Black & Decker",NA,"Grey",NA,NA,NA,"14.4V Lithium Ion",NA,"SVA420B-GB",0.891666666666667
"HOU","SWE","454073","Black & Decker Steam Mop 1300W","Black & Decker",NA,NA,"1","Plastic, Steel",NA,NA,NA,NA,0.833333333333333
"HOU","SWE","454074","Black & Decker Steam Mop 7 in 1 Gen 1300W andAccessories","Black & Decker",NA,NA,"1",NA,NA,NA,NA,NA,0.775
"HOU","SWE","454075","Black & Decker SteaMitt Glove Accessory Pack","Black & Decker",NA,NA,"1","Rubber and Microfibre",NA,NA,NA,NA,0.883333333333333
"HOU","SWE","454076","Black and Decker SteaMitt Replacement Pads 2pk","Black & Decker",NA,NA,"2 Pack","Microfibre",NA,NA,NA,NA,0.783333333333333
"HOU","SWE","454077","Black & Decker Steam Mop Replacement Pads 2pk","Black & Decker",NA,NA,"2 Pack","Microfibre",NA,NA,NA,NA,0.833333333333333
"HOU","SWE","453878","Hoover Whirlwind Bagless Upright Vacuum Cleaner750w WR71WR01","Hoover",NA,NA,NA,NA,NA,"750w",NA,"39100460",0.833333333333333
"HOU","SWE","453884","Hoover Whirlwind Bagless Cylinder Vacuum Cleaner700w SE71WR01","Hoover",NA,NA,NA,NA,NA,"700w",NA,"SE71WR01",0.833333333333333
"HOU","SWE","453889","Hoover Free Motion Cordless 2 in 1 Vacuum CleanerBagless 14.4V","Hoover","110 x 28.5 x 16.5 cm (H x W x D)",NA,NA,NA,NA,"14.4V NiMH",NA,"FM144B2",0.891666666666667
"HOU","SWE","454750","Hoover Capture Bagged Compact Cylinder VacuumCleaner 700w BV71CP10","Hoover",NA,NA,NA,NA,NA,"700w",NA,"BV71CP10",0.833333333333333
"HOU","SWE","417186","Prolectrix 2 in 1 Swift Vacuum Cleaner 600wEF0247WK0","PROlectrix",NA,NA,NA,NA,NA,"600W",NA,"EF0247WK0",0.883333333333333
"HOU","SWE","436775","Prolectrix Triangular Steam Cleaner EF0248WK","PROlectrix",NA,"Orange","1","ABS",NA,NA,NA,NA,0.941666666666667
"HOU","SWE","169287","Wilko Panasonic Vacuum Cleaner Bags 5pk","Wilko","5 Pack","Brown",NA,NA,NA,NA,NA,NA,0.883333333333333
"HOU","SWE","169288","Wilko Vax Vacuum Cleaner Bags 4pk","Wilko","4 Pack","Brown",NA,NA,NA,NA,NA,"Code 11",0.941666666666667
"HOU","SWE","169291","Wilko Electrolux or Zanussi Vacuum Cleaner Bags5pk","Wilko","5 Pack","Brown",NA,NA,NA,NA,NA,"Code 3",0.941666666666667
"HOU","SWE","169295","Wilko Panasonic on Samsung  Vacuum Cleaner Bags5pk","Wilko","5 Pack","Brown",NA,NA,NA,NA,NA,NA,0.883333333333333
"HOU","SWE","169296","Wilko Hoover Vacuum Cleaner Bags 5pk","Wilko",NA,"Brown",NA,NA,NA,NA,NA,"Code 15",0.883333333333333
"HOU","SWE","174869","Wilko Henry Vacuum Cleaner Bags for Henry 5pk","Wilko",NA,NA,NA,NA,NA,NA,NA,NA,0.766666666666667
"HOU","SWE","199036","Wilko  Electrolux Vacuum Cleaner Bags 5pk","Wilko","5 Pack","Brown",NA,NA,NA,NA,NA,NA,0.883333333333333
"HOU","SWE","296407","Wilko  Electrolun and Hoover Vacuum Cleaner Bags5pk","Wilko","16.5x18.5cm","Brown",NA,NA,NA,NA,NA,NA,0.883333333333333
"HOU","SWE","296408","Wilko Universal Vacuum Cleaner Bags 3pk","Wilko","3 Pack","Brown",NA,NA,NA,NA,NA,NA,0.883333333333333
"HOU","SWE","296430","Wilko Cleaning Vacuum Lemon Scent Sticks 5pk","Wilko",NA,"Yellow",NA,NA,NA,NA,NA,NA,0.825
"HOU","SWE","329082","Wilko Miele Vacuum Cleaner Bags 5pk","Wilko",NA,"Brown",NA,NA,NA,NA,NA,NA,0.825
"HOU","WAR","264999","JML Bobble Off","JML",NA,"Multi","1",NA,NA,NA,NA,NA,0.93
"HOU","WAR","428334","Single Fabric Wardrobe","Misterpack","75x50x145cm when assembled","Brown","1",NA,NA,NA,NA,NA,0.85
"HOU","WAR","328404","Packmate Travel Roll Storage Bags 3pk","Pack Mate","Medium","Multi","3k",NA,NA,NA,NA,NA,0.85
"HOU","WAR","190023","Wilko Lint Roller 10m","Wilko","10m",NA,"1",NA,NA,NA,NA,NA,1
"HOU","WAR","190024","Wilko Lint Roller Refill 10m","Wilko","10m",NA,"1",NA,NA,NA,NA,NA,1
"HOU","WAR","230807","Wilko Storage Garment Rail Single 160cm approx","Wilko","95x160cm","Multi","1","Stainless Steel",NA,NA,"10kg",NA,1
"HOU","WAR","232356","Wilko Garment Cover 127 x 61cm 2pk","Wilko","127x61cm","Clear","2","Polyethylene, Polyester",NA,NA,NA,NA,0.95
"HOU","WAR","232357","Wilko Garment Cover Clear 97 x 61cm 2pk","Wilko","97x61cm","Clear","1","Polyethelene, Polyester",NA,NA,NA,NA,0.95
"HOU","WAR","232360","Wilko Vacuum Sealed Storage Bags 2 Sizes 2pk","Wilko","70x40cm","Multi","2",NA,NA,NA,NA,NA,0.9
"HOU","WAR","264634","Wilko Wire Coat Hangers 10pk","Wilko",NA,"White","10pk",NA,NA,NA,NA,NA,0.883333333333333
"HOU","WAR","273272","Wilko Cedar Moth Balls 20pk","Wilko",NA,NA,"20pk",NA,NA,NA,NA,NA,0.9125
"HOU","WAR","273493","Wilko Velvet Coat Hangers 5pk","Wilko","5 Pack","Black","5","Plastic and Wire",NA,NA,NA,NA,1
"HOU","WAR","300320","Wilko Over Door Hooks 2pk","Wilko",NA,"White","2",NA,NA,NA,NA,NA,0.883333333333333
"HOU","WAR","300321","Wilko Vacuum Sealed Storage Bags Large 2pk","Wilko","Large","Multi","2",NA,NA,NA,NA,NA,0.9
"HOU","WAR","300322","Wilko Vacuum Sealed Storage Bags Extra Large 2pk","Wilko","Jumbo","Multi","2pk",NA,NA,NA,NA,NA,0.9
"HOU","WAR","300329","Wilko Underbed Storage Bag Beige","Wilko","16x104x46cm","Brown","1","Polypropylene",NA,NA,NA,NA,0.95
"HOU","WAR","300332","Wilko Garment Cover 100 x 60cm","Wilko","100x60cm","Brown","1","Polypropylene",NA,NA,NA,NA,0.95
"HOU","WAR","300333","Wilko Garment Cover 135 x 60cm","Wilko","135x60cm","Blue",NA,"Polypropylene",NA,NA,NA,NA,0.9
"HOU","WAR","300337","Wilko Beechwood Triple Brush","Wilko",NA,NA,"1",NA,NA,NA,NA,NA,0.9125
"HOU","WAR","300339","Wilko Scented Sachets White Rose and CottonFlower Fragrance 5pk","Wilko",NA,NA,"5pk",NA,NA,NA,NA,NA,0.9125
"HOU","WAR","300340","Wilko Scented Drawer Liners 6pk","Wilko","34x28cm",NA,"6pk",NA,NA,NA,NA,NA,1
"HOU","WAR","327954","Wilko Soft Grip Plastic Coat Hangers 3pk","Wilko",NA,"Multi","3","Polypropylene Regrind",NA,NA,NA,NA,0.941666666666667
"HOU","WAR","327956","Wilko Adult Coat Hangers 8pk","Wilko","Adult",NA,"8pk","N/A",NA,NA,NA,NA,0.941666666666667
"HOU","WAR","327957","Wilko Adult Coat Hangers Purple 8pk","Wilko","Adult","Purple","8","Polypropylene Regrind",NA,NA,NA,NA,1
"HOU","WAR","327960","Wilko Adult Coat Hangers Charcoal 8pk","Wilko","8 Pack","Black","8",NA,NA,NA,NA,NA,0.941666666666667
"HOU","WAR","327962","Wilko Wooden Coat Hangers 5pk","Wilko",NA,"Cream","5pk","Wood",NA,NA,NA,NA,0.941666666666667
"HOU","WAR","327965","Wilko Trouser Hanger Velvet Covered Black 2pk","Wilko","2 Pack","Black","2","Velvet",NA,NA,NA,NA,1
"HOU","WAR","327966","Wilko Scarf Hanger Velvet Black","Wilko",NA,"Black","1",NA,NA,NA,NA,NA,0.883333333333333
"HOU","WAR","327967","Wilko Necklace Hanger Velvet Black","Wilko",NA,"Black","1",NA,NA,NA,NA,NA,0.883333333333333
"HOU","WAR","327969","Wilko Rubber Coated Coat Hangers Assorted 6pk","Wilko",NA,"Multi","6","Plastic and Wire",NA,NA,NA,NA,0.941666666666667
"HOU","WAR","328353","Wilko Wooden Coat Hangers White 5pk","Wilko",NA,"White","5","Wood",NA,NA,NA,NA,0.941666666666667
"HOU","WAR","328405","Wilko Plastic Shoe Box and Lid Clear Small11 x 19 x 33cm","Wilko","11x19x33cm","Clear","1","Polypropelyne",NA,NA,NA,NA,0.95
"HOU","WAR","328427","Wilko  Plastic Shoe Boxand Lid Clear Large14 x 26 x 36cm","Wilko","14x26x36cm","Clear","1","Polypropelyne",NA,NA,NA,NA,0.95
"HOU","WAR","329089","Wilko Wooden Mahogany Coat Hangers 5pk","Wilko",NA,"Wood","5","Wood",NA,NA,NA,NA,0.941666666666667
"HOU","WAR","333859","Wilko Wardrobe Organiser 120 x 25 x 35cm","Wilko","120cmx25cmx35cm","Blue","1","Polypropylene",NA,NA,NA,NA,0.95
"HOU","WAR","333860","Wilko Shoe Organiser 127 x 25 x 30cm","Wilko","127cmx25cmx30cm","Brown","1","Polypropylene",NA,NA,NA,NA,0.95
"HOU","WAR","333861","Wilko Laundry Bag 53 x 58cm","Wilko","53cmx58cm","Blue",NA,"Polypropylene",NA,NA,NA,NA,0.941666666666667
"HOU","WAR","400027","Wilko Jumbo Coat Hanger Charcoal 6pk","Wilko","Jumbo","Black","6","N/A",NA,NA,NA,NA,1
"HOU","WAR","417446","Wilko Wooden Skirt Hangers 3pk","Wilko",NA,NA,"3","Wood",NA,NA,NA,NA,0.883333333333333
"HOU","WAR","417447","Wilko Skirt Hangers with Rubber Tipped Clasps 6pk","Wilko",NA,NA,"6","Plastic and Wire",NA,NA,NA,NA,0.883333333333333
"HOU","WAR","417449","Wilko Hanging Moisture Dehumidifier","Wilko",NA,NA,"1",NA,NA,NA,NA,NA,0.9125
"HOU","WAR","417453","Wilko Vacuum Sealed Storage Bags 2pk","Wilko","Large",NA,"2",NA,NA,NA,NA,NA,0.85
"HOU","WAR","417488","Jumbo Storage Bag 120g","Wilko","H 46 x W 91 x D 53cm",NA,"1",NA,NA,NA,NA,NA,0.8
"HOU","WAR","437028","Wilko Kids Hangers 5pk","Wilko","Kids","Multi","5","Polypropylene",NA,NA,NA,NA,1
"HOU","WAR","454068","Wilko Underbed Storage Box 28L","Wilko","28L",NA,"1","Polypropylene",NA,NA,"28L",NA,0.9
"HOU","WAR","454069","Wilko Storage Box Pot Pourri 18L","Wilko","18L",NA,"1","Polypropylene",NA,NA,"18L",NA,0.9
"HOU","WAR","230831","Zensect Moth Proofer Lavender Fragrance 20pk","Zensect",NA,NA,"20",NA,NA,NA,NA,NA,0.9125
"HOU","WAR","292469","Zensect Hanging Moth Proofer Lavender Fragrance4pk","Zensect","8x7.5cm",NA,"4",NA,NA,NA,NA,NA,1
