"Article","Web Description","Brand","Type","Pack Qty","Size","Colour","Power","DQ Score"
"178606","Air Wick Plug In Refill Air FreshenerCrisp Linen and Lilac","Air Wick","Refills",NA,"17ml",NA,NA,0.86
"182755","Air Wick Air Freshener Electric Refill Lavender17ml","Air Wick","Refills",NA,"21ml",NA,NA,0.86
"237316","Air Wick Freshmatic Colours of Nature RefillWhite Vanilla Bean 250ml","Air Wick","Refills",NA,"250ml",NA,NA,0.9125
"244594","Air Wick Freshmatic Max Refill Touch of LuxuryCrisp Linen and Lilac 250ml","Air Wick","Refills",NA,"250ml",NA,NA,0.9125
"293403","Air Wick Plug Refill Vanilla Bean","Air Wick","Refills","1","17ml",NA,NA,0.93
"333110","Air Wick Electrical Plug In Twin Refill AirFreshener Crisp Linen & Lilac","Air Wick","Refills","1","2x17ml",NA,NA,0.93
"333111","Air Wick Electric Air Freshener Twin Refill PurpleLavender","Air Wick","Refills","1","2x17ml",NA,NA,0.93
"346442","Air Wick Freshmatic Max Automatic Spray GadgetWhite","Air Wick","Units","1",NA,NA,NA,0.9125
"346443","Air Wick Freshmatic Max Air Freshener Gadget Stone","Air Wick","Units","1",NA,NA,NA,0.9125
"403509","Air Wick Candle White Vanilla Bean","Air Wick","Branded Candles","1",NA,"Multi",NA,0.93
"420419","Air wick Wax Melt Complete Mulled Wine By The Fire","Air Wick","Wax Melts Holder","1",NA,NA,NA,0.86
"420421","Air Wick Wax Melt Refill Mulled Wine by the Fire6pk","Air Wick","Wax Melt Refills","1",NA,NA,NA,0.86
"420422","Air Wick Life Scents Wax Melts Refill SummerDelights 6pk","Air Wick","Wax Melt Refills","1",NA,NA,NA,0.86
"420424","Air Wick Life Scents Wax Melts Refill TurquoiseOasis 6pk","Air Wick","Wax Melt Refills","1",NA,NA,NA,0.86
"420426","Air Wick Pure Air Freshener Mulled Wine 250ml","Air Wick","Room Sprays","1",NA,NA,NA,0.9125
"420427","Air Wick Pure Air Freshener Spray Cherry Blossom250ml","Air Wick","Room Sprays","1",NA,NA,NA,0.9125
"426233","Air Wick Freshmatic Twin Refill Mulled Wine 500ml","Air Wick","Refills","1",NA,NA,NA,0.9125
"429179","Air Wick Candle Pink Sweet Pea","Air Wick","Branded Candles","1","105g",NA,NA,0.93
"429208","Air Wick Electric Plug Single Unit","Air Wick","Units","1","50g",NA,NA,0.93
"429221","Air Wick Electric Single Refill Pink Sweet Pea","Air Wick","Refills","1","17ml",NA,NA,0.93
"429226","Air Wick Electric Twin Refill Pink Sweet Pea","Air Wick","Refills","2","17ml",NA,NA,0.93
"429228","Air Wick Life Scents Wax Melts Refill EnchantedForest 6pk","Air Wick","Wax Melt Refills","1","69kg",NA,NA,0.93
"430998","Air wick Electrical Twin Refill Vanilla","Air Wick","Refills","2","34ml",NA,NA,0.93
"441498","Air Wick Wax Melt Refill Xmas Tree Wishes 6pk","Air Wick","Wax Melt Refills","1",NA,NA,NA,0.86
"443578","Air Wick Refill Spiced Mulled Wine 17ml","Air Wick","Refills","1","17ml",NA,NA,0.93
"443579","Air Wick Electric Twin Refill Mulled Wine 34ml","Air Wick","Refills","1",NA,NA,NA,0.86
"443580","Air Wick Candle Mulled Wine 105g","Air Wick","Candle","1",NA,NA,NA,0.86
"450626","Air Wick Electric Complete Linen And Lilac","Air Wick","Units","1","6.2 X 11.5 X 15",NA,NA,0.93
"450627","Air Wick Electric Complete Lavender Meadow","Air Wick","Units","1","6.2 X 11.5 X 15",NA,NA,0.93
"450628","Air Wick Electric Complete Vanilla Bean","Air Wick","Units","1","6.2 X 11.5 X 15",NA,NA,0.93
"333074","Ambi Pur Plug In Adjustable Diffuser","Ambi Pur","Units","1",NA,NA,"Mains",0.93
"333184","Ambi Pur with Febreze GP2 Refill Vanilla","Ambi Pur","Refills",NA,"20ml",NA,NA,0.86
"333197","Ambi Pur 3Volution Plug In Unit","Ambi Pur","Units","1",NA,NA,"Mains",0.93
"333198","Ambi Pur 3volution Adjustable Diffuser Refill withFebreze Vanilla Bouquet 20ml","Ambi Pur","Refills",NA,"20ml",NA,NA,0.86
"333200","Ambi Pur 3volution Adjustable Diffuser Refill withFebreze Cotton Essence 20ml","Ambi Pur","Refills","1","20ml",NA,NA,0.93
"333208","Ambi Pur 3volution Adjustable Diffuser Refill withFebreze Vanilla Bouquet 20ml x 2","Ambi Pur","Refills",NA,"2x20ml",NA,NA,0.86
"346492","AmbiPur Plug In Diffuser Refill Vanilla Harmony 2x 20ml","Ambi Pur","Refills","2pk","40ml",NA,NA,0.88
"347399","Ambi Pur 3Volution Refill Vanilla 20ml","Ambi Pur","Refills",NA,"20ml",NA,NA,0.86
"347404","Ambi Pur GP2 Refill Vanilla 20ml","Ambi Pur","Refills",NA,"20ml",NA,NA,0.86
"420458","Ambi Pur with Febreze Plug In Cotton Fresh","Ambi Pur","Units","1",NA,NA,NA,0.86
"420459","Ambi Pur with Febreze Plug In Blossom andBreeze","Ambi Pur","Units","1",NA,NA,NA,0.86
"420460","Ambi Pur with Febreze Plug In Lavender","Ambi Pur","Units","1",NA,NA,NA,0.86
"420463","Ambi Pur with Febreze 3 Volution Unit","Ambi Pur","Units","1",NA,NA,NA,0.86
"421425","Ambi Pur with Febreze Refill Blossom and Breeze","Ambi Pur","Refills","1",NA,NA,NA,0.86
"421426","Ambi Pur with Febreze Refill Cotton Fresh 20ml","Ambi Pur","Refills","1",NA,NA,NA,0.86
"421427","Ambi Pur with Febreze Refill Thai Orchid","Ambi Pur","Refills","1",NA,NA,NA,0.86
"421428","Ambi Pur with Febreze 3 Volution Blossom andBreeze","Ambi Pur","Refills","1",NA,NA,NA,0.86
"421429","Ambi Pur with Febreze 3 Volution Cotton Fresh","Ambi Pur","Refills","1",NA,NA,NA,0.86
"421431","Ambi Pur with Fabreze Refill Lavender","Ambi Pur","Refills","1",NA,NA,NA,0.86
"421432","Ambi Pur with Febreze 3 Volution Lavender","Ambi Pur","Refills","1",NA,NA,NA,0.86
"421435","Ambi Pur with Febreze Refill Lavender 2pk","Ambi Pur","Units","1",NA,NA,NA,0.86
"421436","Ambi Pur with Febreze 3 Volution Thai Orchid","Ambi Pur","Refills","1",NA,NA,NA,0.86
"421556","Ambi Pur GP2 Twin Refill Cotton 2 x 20ml","Ambi Pur","Refills","2pk","2x20ml",NA,NA,0.93
"430232","Ambi Pur with Febreze 3 Volution Thai Orchid20ml","Ambi Pur","Refills","1","20ml",NA,NA,0.93
"441487","Ambi Pur 3vol Cotton Starter Kit 20ml","Ambi Pur","Units","1","20ml",NA,NA,0.93
"441490","Ambi Pur 3vol Blossom Starter Kit 20ml","Ambi Pur","Units","1","20ml",NA,NA,0.93
"450176","Ambi Pur 3Volution Refill Pet Odour","Ambi Pur","Refills","1","20ml",NA,NA,0.93
"450177","Ambi Pur 3Volution Refill Anti Tobacco","Ambi Pur","Refills","1","20ml",NA,NA,0.93
"450179","Ambi Pur Plug In Air Freshener RefillAnti Tobacco","Ambi Pur","Refills","1","20ml",NA,NA,0.93
"bh00007","Better Home Gentle Grip Pegs 100pk","Better Home Products","Pegs","100",NA,"Multi",NA,0.88
"bh00008","Better Home Wall Mount Airer Silver","Better Home Products","Outdoor Airer","1","198 cm wide x 39.5cm Hiigh",NA,NA,0.88
"bh00010","Better Home Heavy Duty Retractable 2 Line","Better Home Products",NA,"1","2 x 15m lines",NA,NA,0.8625
"298004","Febreze Set and Refresh Non Energised Scented OilDiffuser Refill Cotton 5.5ml x 2","Febreze","Units",NA,"2x5.5ml",NA,NA,0.9125
"298005","Febreze Set and Refresh Cotton Fresh 5.5ml","Febreze","Units",NA,"5.5ml",NA,NA,0.9125
"298006","Febreze Set and Refresh Blossom and Breeze 5.5ml","Febreze","Units",NA,"5.5ml",NA,NA,0.9125
"333480","Febreze Car Discreet Vent Clip Air Freshener Cotton Fresh 2ml","Febreze","Air Fresheners",NA,"2ml",NA,NA,0.9125
"347441","Febreze Airspray Vanilla 300ml","Febreze","Room Sprays",NA,"300ml",NA,NA,0.9125
"347476","Febreze Car Gel Vanilla Blossom","Febreze","Air Fresheners","1",NA,NA,NA,0.9125
"403600","Febreze Set N Refresh Unit Vanilla Blossom","Febreze","Units","1",NA,NA,NA,0.9125
"403602","Febreze Fabric Refresher Vanilla Blossom 375ml","Febreze","Fabric Fresheners",NA,"375ml",NA,NA,0.9125
"133277","Glade Solid Air Freshener Lily of the Valley150g","Glade","Units",NA,"150g",NA,NA,0.9125
"137115","Glade Solid Air Freshener Lavender 150g","Glade","Units",NA,"150g",NA,NA,0.9125
"182744","Glade Touch n Fresh Unit Clean Linen","Glade","Units",NA,"10ml",NA,NA,0.9125
"216794","Glade Plug In Electric Refill Linen","Glade","Refills","1","20ml",NA,NA,0.93
"293109","Glade Solid Relaxing Zen 150g","Glade","Units",NA,"150g",NA,NA,0.9125
"298000","Glade Discreet Air Freshener Plug In and Refill Clean Linen 12g","Glade","Units","1","12g",NA,NA,0.93
"298122","Glade Discreet Air Freshener Refill Clean Linen 12g","Glade","Refills",NA,"12g",NA,NA,0.9125
"346447","Glade Automatic Spray Refill Relaxing Zen 269ml","Glade","Refills","1",NA,NA,NA,0.9125
"346482","Glade Auto Refill Bali Sandalwood and Jasmine","Glade","Refills","1",NA,NA,NA,0.9125
"346483","Glade Auto Refill  Clean Linen","Glade","Refills","1",NA,NA,NA,0.9125
"347537","Glade Discreet Refill Relaxing Zen","Glade","Refills","1",NA,NA,NA,0.9125
"348538","Glade Sense and Spray Unit Relaxing Zen","Glade","Units","1",NA,NA,NA,0.9125
"349714","Glade Candle Relaxing Zen 120g","Glade","Branded Candles",NA,"120g","Multi",NA,0.93
"352945","Glade Sense and Spray Refill Relaxing Zen","Glade","Refills","1",NA,NA,NA,0.9125
"403475","Glade 5in1 Air Freshener Relaxing Zen 300ml","Glade","Room Sprays","1",NA,NA,NA,0.9125
"403477","Glade Touch n Fresh Refill Lilly Of The Valley","Glade","Refills","1",NA,NA,NA,0.9125
"403481","Glade Touch n Fresh Unit Relaxing Zen","Glade","Units","1",NA,NA,NA,0.9125
"411790","Glade Plug In Electric Unit Clean Linen 20ml","Glade","Units","1","20ml",NA,NA,0.93
"411791","Glade Plug In Electric Unit Laven 20ml","Glade","Units","1","20ml",NA,NA,0.93
"411792","Glade Plug In Electric Unit Bali Sandal 20ml","Glade","Units","1","20ml",NA,NA,0.93
"411799","Glade Discreet Electric Relaxing Zen","Glade","Units","1",NA,NA,NA,0.86
"411805","Glade Discreet Refill Bali Sandalwood and Jasmine","Glade","Refills","1",NA,NA,NA,0.9125
"412168","Glade Plug In Refill Bail Sandalwood and Jasmine","Glade","Refills","1",NA,NA,NA,0.86
"420397","Glade Wax Refill Vanilla 6pk","Glade","Wax Melt Refills","1",NA,NA,NA,0.86
"420399","Glade Wax Refill Clean Linen 6pk","Glade","Wax Melt Refills","1",NA,NA,NA,0.86
"420400","Glade Wax Refill Bali Sandalwood and Jasmine 6pk","Glade","Wax Melt Refills","1",NA,NA,NA,0.86
"420416","Glade Automatic Spray Unit Relaxing Zen","Glade","Units","1",NA,NA,NA,0.9125
"420417","Glade Automatic Spray Unit Bali Sandalwoodand Jasmine","Glade","Units","1",NA,NA,NA,0.9125
"425111","Glade Sense & Spray Refill Clean Linen 2pk","Glade","Refills","1",NA,NA,NA,0.9125
"427211","Glade Sense & Spray Refill Relaxing Zen 2pk","Glade","Refills","1",NA,NA,NA,0.9125
"427212","Glade Autospray Refill Relaxing Zen 2pk","Glade","Refills",NA,NA,NA,NA,0.825
"427225","Glade Autospray Refill Clean Linen 2pk","Glade","Refills",NA,NA,NA,NA,0.825
"182715","Neutradol Gel Odour Destroyer Super Fresh","Neutradol","Units","1",NA,NA,NA,0.9125
"77647","Neutradol Gel Original","Neutradol","Units","1",NA,NA,NA,0.9125
"237924","Oust Odour Eliminator Air Freshener Garden Fresh300ml","Oust","Room Sprays",NA,"300ml",NA,NA,0.9125
"453904","Status Portable Heated Clothes Airer With Wings","Status","Electric Airer","1",NA,NA,NA,0.86
"107006","Wilko Deluxe Clothes Airer 14m","Wilko","Indoor Airer",NA,"14m","Multi",NA,0.93
"1292440","Wilko Concertina Clothes Airer 3 Tier 8.4m","Wilko","Indoor Airer",NA,"8.4m","White",NA,0.93
"300176","Wilko Over Door Hanger 3in1","Wilko","Indoor Airer","1",NA,"Purple",NA,0.93
"300177","Wilko Extendable Clothes Airer 3 Tier 7.5m","Wilko","Indoor Airer",NA,"14m","Silver",NA,0.93
"328257","Wilko Ground Screw with Inserts Grey","Wilko","Washing Lines and Accessories",NA,"Small, Medium, Large","Multi",NA,0.93
"403886","MobiDri Portable Washing Line","Wilko","Indoor Airer","1",NA,"Black",NA,0.88
"419544","Wilko Gel Pearl Cotton 100g","Wilko","Units",NA,NA,NA,NA,0.825
"419545","Wilko Gel Pearl Lavender 100g","Wilko","Units",NA,NA,NA,NA,0.825
"419546","Wilko Reed Diffuser Cotton","Wilko","Branded Reed Diffusers",NA,NA,NA,NA,0.825
"419547","Wilko Reed Diffuser Vanilla","Wilko","Branded Reed Diffusers",NA,NA,NA,NA,0.825
"419551","Wilko Liquid Wick Vanilla 75ml","Wilko","Liquid Units",NA,NA,NA,NA,0.825
"419552","Wilko Liquid Wick Cotton 75ml","Wilko","Liquid Units",NA,NA,NA,NA,0.825
"419553","Wilko Liquid Wick Lavender 75ml","Wilko","Liquid Units",NA,NA,NA,NA,0.825
"419556","Wilko Plug In Starter Lavender","Wilko","Units",NA,NA,NA,NA,0.79
"429887","Wilko Plug In Twin Refill Cotton","Wilko","Refills","2",NA,NA,NA,0.86
"429889","Wilko Plug-in Refills Lavender 20ml","Wilko","Refills","2","20ml",NA,NA,0.93
"432698","Wilko Rotary Airer 40m","Wilko","Outdoor Airer","1","40m",NA,NA,0.93
"432699","Wilko Rotary Airer 50m","Wilko","Outdoor Airer","1","50m",NA,NA,0.93
"450202","Wilko Wax Melt Refill Pink Posies 4pk","Wilko","Wax Melt Refills","1","44g",NA,NA,0.93
"450203","Wilko Wax Melt Refill Orchid Delight 4pk","Wilko","Wax Melt Refills","1","44g",NA,NA,0.93
"450204","Wilko Wax Melt Refill Summer Fruits 5pk","Wilko","Wax Melt Refills","1","44g",NA,NA,0.93
"450205","Wilko Wax Melt Refill Rhubarb Sugar Melon 4pk","Wilko","Wax Melt Refills","1","44g",NA,NA,0.93
"450206","Wilko Wax Melt Refill Warming Spice 4pk","Wilko","Wax Melt Refills","1","44g",NA,NA,0.93
"450207","Wilko Wax Melt Refill Vanilla Pod 4pk","Wilko","Wax Melt Refills","1","44g",NA,NA,0.93
"450208","Wilko Wax Melt Refill Woodland Escape 4pk","Wilko","Wax Melt Refills","1","44g",NA,NA,0.93
"450209","Wilko Wax Melt Refill White Linen 4pk","Wilko","Wax Melt Refills","1","44g",NA,NA,0.93
