"Article","Web Description","Brand","Type","Colour","Size","Assembly","Material","DQ Score"
"327818","Wilko Mosaic Glass Shelf Silver","Wilko","Bathroom Shelves","Silver","Single","No",NA,0.941666666666667
"327819","Wilko Mosaic Towel Rail Silver","Wilko","Towel Rails and Hooks","Silver","Single","No",NA,0.941666666666667
"327821","Wilko Mosaic Robe Hook Silver","Wilko","Towel Rails and Hooks","Silver","Single","No",NA,0.941666666666667
"327822","Wilko Mosaic Towel Ring Silver","Wilko","Towel Rails and Hooks","Silver","Single","No",NA,0.941666666666667
"327823","Wilko Mosaic Glass and Holder Silver","Wilko","Tumblers","Silver","Single","No",NA,0.941666666666667
