"Article","Web Description","Brand","Capacity","Type","Colour","Pack Qty","Size","Material","DQ Score"
"424615","Country Club Storage Chest Hearts Design","Country Club",NA,"Storage Box with Lid",NA,"1","50cm x 40cm x 30cm","non woven poly covered fabric",0.9
"424616","Country Club Storage Chest Roadworks","Country Club",NA,"Storage Box with Lid",NA,"1","50CM X 40CM X 30CM","non woven poly covered fabric",0.9
"410431","Wilko Tote Boxes Dinosaur 3pk","Wilko",NA,"Storage Totes",NA,"3","Set of 3",NA,0.85
"422992","Wilko Storage Tower Pink 3 Drawer","Wilko",NA,"Storage Drawers","Multi","1","40x40x63cm","Polypropelyne",0.95
"422995","Wilko Underbed Box Blue 45L","Wilko","45L","Storage Box with Lid",NA,"1","40x60x27cm","Polypropelyne",0.95
"432848","Wilko Pop Up Storage Blue","Wilko",NA,"Pop Up Bins",NA,"1","37.5cm High, 37.5cm Diameter","POLYPROPYLENE",0.9
"432854","Wilko Pop Up Storage Pink","Wilko",NA,"Pop Up Bins",NA,"1","37.5cm High, 37.5cm diameter","POLYPROPYLENE",0.9
