"Article","Web Description","Brand","Type","Pack Qty","Size","DQ Score"
"193722","Wilko Wild Bird Cake and Scrap Feeder","Wilko","Suet Feeder","1",NA,0.9125
"229003","Wilko Wild Bird Suet with Mealworm 300g","Wilko","Suets",NA,"300g",0.9125
"249528","Wilko Wild Bird Suet with Fruit Mix 300g","Wilko","Suets",NA,"300g",0.9125
"266861","Wilko Wild Bird Suet Pellets with Insect 550g","Wilko","Suets",NA,"550g",0.9125
"266939","Wilko Wild Bird Suet Pellets with Mealworm 550g","Wilko","Suets",NA,"550g",0.9125
"412540","Wilko Wild Bird Suet Log Feeder","Wilko","Suet Feeder","1",NA,0.9125
