"Article","Web Description","Brand","Type","Colour","Pack Qty","Size","DQ Score"
"112247","Unibond Quick Grout Triple Protection Anti-Mould Waterproof White 300g","Unibond","Ready Mixed Grout",NA,NA,"300g",0.86
"234976","Unibond Wall Tile Adhesive and Grout with Anti-Mould White 3.2kg","Unibond","Ready Mixed Grout",NA,NA,"Standard",0.86
"256754","Unibond Anti Mould Grout Reviver for Walls and Floors Ice White 15ml","Unibond","Grout Reviver",NA,"1","15ml",0.93
"256755","Unibond Grout Reviver White 125ml","Unibond","Grout Reviver",NA,"1","125ml",0.93
"293620","UniBond Quick Fix and Grout Tube Large Ice White","Unibond","Ready Mixed Grout",NA,"1",NA,0.86
"35842","Unibond Advanced All Purpose Waterproof Adhesive and Grout with Anti-Mould White 1.38kg","Unibond","Ready Mixed Grout",NA,"1","1.38kg",0.93
"74273","Unibond Advanced All Purpose Waterproof Adhesive 1.5kg","Unibond","Waterproof Adhesive",NA,"1","1.5kg",0.93
"157238","Wilko Decorator Wall Tile Adhesive and Grout ReadyMixed Brilliant White 690g","Wilko","Ready Mixed Grout",NA,NA,"690g",0.86
"157239","Wilko Decorator Wall Tile Adhesive and Grout Brilliant White Economy 1.38kg","Wilko","Ready Mixed Grout",NA,"1","1.38kg",0.93
"209300","Wilko Diamond Tipped Glass Cutter","Wilko","Tools",NA,"1",NA,0.86
"343756","Wilko Tile Spacers 2mm 200pk","Wilko","Tools",NA,"200pcs","2mm",0.93
"343770","Wilko Wall Trowel","Wilko","Tools",NA,"1","6mm Notch",0.93
"78005","Wilko Decorator Wall Tile Fix and Grout Ready Mixed Brilliant White 300g","Wilko","Ready Mixed Grout",NA,NA,"300ml",0.86
