"Article","Web Description","Brand","Type","Pack Qty","Size","DQ Score"
"433309","Double Sided Lint Brush","Korbond","Lint Remover","1",NA,0.8625
"273272","Wilko Cedar Moth Balls 20pk","Wilko","Moth Proofers","20pk",NA,0.9125
"300337","Wilko Beechwood Triple Brush","Wilko","Clothes Brush ","1",NA,0.9125
"300339","Wilko Scented Sachets White Rose and CottonFlower Fragrance 5pk","Wilko","Scented Sachets","5pk",NA,0.9125
"417449","Wilko Hanging Moisture Dehumidifier","Wilko","Dehumidifier","1",NA,0.9125
"230831","Zensect Moth Proofer Lavender Fragrance 20pk","Zensect","Moth Proofers","20",NA,0.9125
