"Article","Web Description","Brand","Type","Pack Qty","Size","DQ Score"
"429120","Alberto Balsam Shampoo Juicy Green Apple350ml","Alberto Balsam","Shampoo","1","350ml",1
"429121","Alberto Balsam Shampoo SunkissedRaspberry 350ml","Alberto Balsam","Shampoo","1","350ml",1
"429122","Alberto Balsam Shampoo Tea Tree Tingle 350ml","Alberto Balsam","Shampoo","1","350ml",1
"429124","Alberto Balsam Tea Tree Tingle Conditioner 350ml","Alberto Balsam","Conditioner","1","350ml",1
"429125","Alberto Balsam Shampoo Coconut and Lychee  350ml","Alberto Balsam","Shampoo","1","350ml",1
"429127","Alberto Balsam Conditioner Coconut 350ml","Alberto Balsam","Conditioner","1","350ml",1
"186569","Aussie 3 Minute Miracle Reconstructor for DamagedHair 250ml","Aussie","Conditioner","1","250ml",1
"193827","Aussie Conditioner Miracle Moist for Dry DamagedHair 250ml","Aussie","Conditioner","1","250ml",1
"261939","Aussie Colour Mate Shampoo 300ml","Aussie","Shampoo","1","300ml",1
"261940","Aussie Colour Mate Conditioner 250ml","Aussie","Conditioner","1","250ml",1
"278444","Aussie Conditioner Mircale Shine For Dull TiredHair 250ml","Aussie","Conditioner","1","250ml",1
"307795","Aussie Mega Shampoo 300ml","Aussie","Shampoo","1","300ml",1
"351653","Aussie Miracle Dry Shampoo Colour Mate forColoured Hair 180ml","Aussie","Shampoo","1","180ml",1
"452986","Aussie 3 Minute Miracle Shine Deep Treatment 250ml","Aussie","Conditioner","1","250ml",1
"320722","Batiste Dry Shampoo Big and Bouncy XXL Volume 200ml","Batiste","Dry Shampoo","1","200ml",1
"320808","Batiste Dry Shampoo Original 200ml","Batiste","Dry Shampoo","1","200ml",1
"320809","Batiste Dry Shampoo Coconut and Exotic Tropical 200ml","Batiste","Dry Shampoo","1","200ml",1
"334581","Batiste Dry Shampoo Fruity and Cheeky Cherry 200ml","Batiste","Dry Shampoo","1","200ml",1
"334583","Batiste Dry Shampoo Blush 400ml","Batiste","Dry Shampoo","1","400ml",1
"446018","Creightons Sunshine Blonde Shampoo 250ml","Creightons","Shampoo","1","250ml",1
"446019","Creightons Sunshine Blonde Conditioner 250ml","Creightons","Conditioner","1","250ml",1
"446020","Creightons Sun Blonde Correct Shampoo 200ml","Creightons","Shampoo","1","200ml",1
"446022","Creightons Crème DeCoconut Shampoo 250ml","Creightons","Shampoo","1","250ml",1
"446023","Creightons Crème DeCoconut Conditioner 250ml","Creightons","Conditioner","1","250ml",1
"446027","Creightons Sun Blonde Corect Conditioner 200ml","Creightons","Conditioner","1","200ml",1
"442250","Dove Shampoo Daily Care 2in1 400ml","Dove","Shampoo","1","400ml",1
"442251","Dove Conditioner Intensive Repair 350ml","Dove","Conditioner","1","350ml",1
"442253","Dove Conditioner Daily Care 350ml","Dove","Conditioner","1","350ml",1
"442254","Dove Shampoo Intensive Repair 400ml","Dove","Shampoo","1","400ml",1
"442256","Dove Shampoo Daily Care 400ml","Dove","Shampoo","1","400ml",1
"136496","Head & Shoulders Classic Clean Shampoo andConditioner 225ml","Head & Shoulders","Shampoo","1","200ml",1
"236476","Head & Shoulders Classic Clean Anti-DandruffShampoo 500ml","Head & Shoulders","Shampoo","1","500ml",1
"242481","Head & Shoulders Citrus Fresh Anti-DandruffShampoo 250ml","Head & Shoulders","Shampoo","1","250ml",1
"265024","Head & Shoulders Anti-Dandruff Shampoo Smooth AndSilky 500ml","Head & Shoulders","Shampoo","1","400ml",1
"274039","Head & Shoulders Anti Dandruff ShampooItchy Scalp 250ml","Head & Shoulders","Shampoo","1","200ml",1
"324072","Head & Shoulders Anti-Dandruff Shampoo AppleFresh 250ml","Head & Shoulders","Shampoo","1","250ml",1
"329356","Head & Shoulders Citrus Fresh 2in1 Shampoo andConditioner 450ml","Head & Shoulders","2 in 1 Shampoo and Conditioner","1","450ml",1
"351686","Head & Shoulders Anti Dandruff Shampoo MentholFresh 500ml","Head & Shoulders","Shampoo","1","500ml",1
"94207","Head & Shoulders Classic Clean Anti-DandruffShampoo 250ml","Head & Shoulders","Shampoo","1","250ml",1
"276575","Herbal Essences Dazzling Shine Conditioner 400ml","Herbal Essences","Conditioner","1","400ml",1
"276576","Herbal Essences Hello Hydration Conditioner 400ml","Herbal Essences","Conditioner","1","400ml",1
"276578","Herbal Essences Shampoo Hello Hydration For DryHair 400ml","Herbal Essences","Shampoo","1","400ml",1
"307836","Herbal Essences Shampoo Bee Strong For DamagedHair 400ml","Herbal Essences","Shampoo","1","400ml",1
"307837","Herbal Essences Conditioner Bee Strong DamagedHair 400ml","Herbal Essences","Conditioner","1","400ml",1
"351705","Herbal Essences Conditioner Ignite My Colour 400ml","Herbal Essences","Conditioner","1","400ml",1
"351763","Herbal Essences Shampoo Ignite My Colour 400ml","Herbal Essences","Shampoo","1","400ml",1
"352702","John Frieda Frizz Ease Extra Strength Hair Serum50ml","John Frieda","Hair Treatments and Oils","1","50ml",1
"352723","John Frieda Shampoo Luxurious Volume 250ml","John Frieda","Conditioner","1","250ml",1
"352724","John Frieda Conditioner Luxurious Volume 250ml","John Frieda","Shampoo","1","250ml",1
"412748","John Frieda Frizz Ease Miraculous RecoveryShampoo 250ml","John Frieda","Shampoo","1","250ml",1
"412749","John Frieda Frizz Ease Miraculous RecoveryConditioner 250ml","John Frieda","Conditioner","1","250ml",1
"438918","John Frieda Sheer Blonde Moisturising 250ml","John Frieda","Shampoo","1","200ml Plastic Tube",1
"438919","John Frieda Sheer Blonde Moist Conditioner 250ml","John Frieda","Conditioner","1","200ml Plastic Tube",1
"438922","John Frieda Sheer Blonde Go Blonder Shampoo 250ml","John Frieda","Shampoo","1","200ml Plastic Tube",1
"438923","John Frieda Sheer Blonde Go Blonder Conditioner250ml","John Frieda","Conditioner","1","200ml Plastic Tube",1
"438924","John Frieda Brunette Colour Protect MoisturisingShampoo 250ml","John Frieda","Shampoo","1","200ml Plastic Tube",1
"438925","John Frieda Brunette Colour Protect MoisturisingConditioner 250ml","John Frieda","Conditioner","1","200ml Plastic Tube",1
"223731","L'Oreal Elvive Colour Protect Coloured HairShampoo 250ml","L'Oreal","Shampoo","1","250ml",1
"224638","L'Oreal Elvive Colour Protect Coloured HairConditioner 250ml","L'Oreal","Conditioner","1","250ml",1
"258465","L'Oreal Elvive Colour Protect Coloured HairShampoo 400ml","L'Oreal","Shampoo","1","400ml",1
"258466","L'Oreal Elvive Full Restore 5 Damaged HairShampoo 400ml","L'Oreal","Shampoo","1","400ml",1
"258468","L'Oreal Elvive Colour Protect Coloured HairConditioner 400ml","L'Oreal","Conditioner","1","400ml",1
"258469","L'Oreal Elvive Full Restore 5 Damaged HairConditioner 400ml","L'Oreal","Conditioner","1","400ml",1
"307579","L'Oreal Elvive Nutri Gloss Shine Dull HairConditioner 400ml","L'Oreal","Conditioner","1","400ml",1
"347741","L'Oreal Elvive Fibrology Fine Hair ThickeningShampoo 400ml","L'Oreal","Shampoo","1","400ml",1
"352328","L'Oreal Elvive Extraordinary Oil Dry Hair Shampoo400ml","L'Oreal","Shampoo","1","400ml",1
"352329","L'Oreal Elvive Extraordinary Oil Dry HairConditioner 400ml","L'Oreal","Conditioner","1","400ml",1
"429010","L'Oreal Elvive Clay Oily Roots Shampoo 400ml","L'Oreal","Shampoo","1","400ml",1
"429011","L'Oreal Elvive Clay Oily Roots Conditioner 400ml","L'Oreal","Conditioner","1","400ml",1
"429012","L'Oreal Elvive Clay Oily Roots Shampoo 250ml","L'Oreal","Shampoo","1","250ml",1
"429013","L'Oreal Elvive Clay Oily Roots Conditioner 250ml","L'Oreal","Conditioner","1","250ml",1
"449219","L'Oreal Elvive Fibrology Air Flat Hair Shampoo400ml","L'Oreal","Shampoo","1","400ml",1
"449220","L'Oreal Elvive Fibrology Air Flat HairConditioner 400ml","L'Oreal","Conditioner","1","400ml",1
"452894","L'Oreal Studio Pro Heat It Hot and Go 150ml","L'Oreal","Heat Protection","1","150ml",1
"278421","Neutrogena T-Gel Shampoo 250ml","Neutrogena","Shampoo","1","250ml",1
"324866","Nizoral Anti Dandruff Shampoo 60ml","Nizoral","Shampoo","1","60ml",1
"236475","Pantene Smooth and Sleek Conditioner 360ml","Pantene","Conditioner","1","400ml",1
"236481","Pantene Smooth and Sleek Shampoo for Dry FrizzyHair 400ml","Pantene","Shampoo","1","400ml",1
"236482","Pantene Repair and Protect Conditioner 360ml","Pantene","Conditioner","1","400ml",1
"236483","Pantene Repair and Protect Shampoo for DamagedHair 400ml","Pantene","Shampoo","1","400ml",1
"252028","Pantene 2 in 1 Shampoo and Conditioner Smooth andSleek for Dry and Frizzy Hair 400ml","Pantene","Shampoo","1","400ml",1
"273854","Pantene Colour Protect Shampoo for Coloured Hair400ml","Pantene","Shampoo","1","400ml",1
"281796","Pantene 2 in 1 Shampoo and Conditioner ClassicClean For Normal Hair 400ml","Pantene","2 in 1 Shampoo and Conditioner","1","400ml",1
"281797","Pantene 2 in 1 Shampoo and Conditioner Volume andBody for Fine Hair 400ml","Pantene","2 in 1 Shampoo and Conditioner","1","400ml",1
"302584","Pantene Colour Protect and Smooth Conditioner360ml","Pantene","Conditioner","1","360ml",1
"48111","Schwarzkopf Gliss Hair Repair Shine Tonic 100ml","Schwarzkopf","Hair Treatments and Oils","1","100ml",1
"429006","Pro Voke Touch Of Silver Brightening Shampoo150ml","Touch of Silver","Shampoo","1","150ml",1
"429007","Pro Voke Touch Of Silver Intense Conditoner150ml","Touch of Silver","Conditioner","1","150ml",1
"429008","Pro Voke Touch Of Silver Colour Care Shampoo200ml","Touch of Silver","Shampoo","1","200ml",1
"429009","Pro Voke Touch Of Silver Colour Care Conditioner200ml","Touch of Silver","Conditioner","1","200ml",1
"219438","Tresemme Deep Cleansing Shampoo 900ml","Tresemme","Shampoo","1","900ml",1
"219439","Tresemme Remoisturising Conditioner 900ml","Tresemme","Conditioner","1","900ml",1
"219440","Tresemme Colour Revitalising Shampoo 900ml","Tresemme","Shampoo","1","900ml",1
"219441","Tresemme Colour Revitalise Colour Fade ProtectionConditioner 900ml","Tresemme","Conditioner","1","900ml",1
"219445","Tresemme Conditioner Moisture Rich 900ml","Tresemme","Conditioner","1","900ml",1
"243338","Tresemme Salon Silk Conditioner 900ml","Tresemme","Conditioner","1","900ml",1
"243339","Tresemme Salon Silk Shampoo 900ml","Tresemme","Shampoo","1","900ml",1
"334635","Tresemme Platinium Strengthening Conditioner 500ml","Tresemme","Conditioner","1","500ml",1
"449771","Tresemme Keratin Smooth Shampoo 500ml","Tresemme","Shampoo","1","500ml",1
"449772","Tresemme Keratin Smooth Conditioner 500ml","Tresemme","Conditioner","1","500ml",1
"306827","VO5 Nourish My Shine Conditioner 250ml","VO5","Conditioner","1","250ml",1
"306828","VO5 Nourish My Shine Shampoo 250ml","VO5","Shampoo","1","250ml",1
"306832","VO5 Give Me Moisture Conditioner 250ml","VO5","Conditioner","1","250ml",1
"429128","VO5 Smoothly Does It Conditioner 250ml","VO5","Conditioner","1","250ml",1
"100424","Vosene Original Shampoo 2in1 250ml","Vosene","Shampoo","1","250ml",1
"306004","Wilko Shampoo Apple  and Tea Tree 750ml","Wilko","Shampoo","1","750ml",1
"306005","Wilko Conditioner Apple Tea Tree 750ml","Wilko","Conditioner","1","750ml",1
"306007","Wilko Conditioner Vanilla 750ml","Wilko","Conditioner","1","750ml",1
"306008","Wilko Shampoo Jojoba 750","Wilko","Shampoo","1","750ml",1
"306009","Wilko Conditioner Jojoba 750ml","Wilko","Conditioner","1","750ml",1
"306011","Wilko Medicated Shampoo 300ml","Wilko","Shampoo","1","300ml",1
"306013","Wilko Anti Dandruff 2 in 1 300ml","Wilko","2 in 1 Shampoo and Conditioner","1","300ml",1
"341061","Wilko Dry Shampoo All Shades 200ml","Wilko","Dry Shampoo","1","200ml",1
"341063","Wilko Dry Shampoo Brunette 200ml","Wilko","Dry Shampoo","1","200ml",1
"347728","Wilko Dry Shampoo Volume 200ml","Wilko","Dry Shampoo","1","200ml",1
"347729","Wilko Dry Shampoo Fragranced 200ml","Wilko","Dry Shampoo","1","200ml",1
