"Article","Web Description","Brand","Type","Colour","Power","Pack Qty","Size","DQ Score"
"407861","Solar Gutter Lights Black Set of 2","Gablemere","Gutter Lights","Black",NA,"2","18 x 13 x 13",0.891666666666667
"283642","Wilko Garden Solar Light Butterfly 50 LED","Wilko","String Lights",NA,"Solar, Battery","50pk",NA,0.883333333333333
"329131","Wilko Solar Light Marker","Wilko","Solar Lights",NA,"Solar, Battery","1",NA,0.883333333333333
"340981","Wilko Garden Solar Light Tiffany Stick","Wilko","Solar Lights",NA,NA,"1",NA,0.825
"455252","Wilko Outdoor Light Dual Illuminator PIR","Wilko","Security Lighting",NA,"2 x 35w","1","W: 7cm x Depth: 11cm x H: 21cm",0.941666666666667
"455253","Wilko Outdoor Light Chimney Wall","Wilko","Security Lighting",NA,"60w","1","W: 17cm x Depth: 19cm x H: 31cm",0.941666666666667
"455254","Wilko Outdoor Light 4 Sided Lantern","Wilko","Security Lighting",NA,"60w","1","W: 15cm x Depth: 18.5cm x H: 35cm",0.941666666666667
"455260","Wilko Outdoor Oblong Wall Light","Wilko","Security Lighting",NA,"60w","1","W: 15cm x Depth: 10cm x H: 28cm",0.941666666666667
