"PSA_1","PSA_2","Article","Web Description","Brand","Size","Colour","Pack Qty","Power","Model Number","DQ Score"
"KIT","ELE","447272","Quest Panini Sandwich Press Grill 35600","Benross","32 x 37 x 14cm","Black",NA,"1200w","35600",0.95
"KIT","ELE","447273","Quest Pancake Crepe Flatbread Maker 35540","Benross","31.5 x 31.5 x 6.5xm","Black",NA,"1000w","35540",0.95
"KIT","ELE","447274","Quest Omelette Maker 35640","Benross","23 x 26.5 x 13cm","Black",NA,"700w","35640",0.95
"KIT","ELE","447275","Quest Compact Mini Oven 9L 35400","Benross","9 Litre","Black",NA,"800w","35400",0.95
"KIT","ELE","447276","Quest Oven with Rotisserie 18L 35390","Benross","18 Litre","Black",NA,"1280w","35390",0.95
"KIT","ELE","447277","Quest Oven with Rotisserie Hot Plates 26L 35370","Benross","26 Litre","Black",NA,"1600w","35370",0.95
"KIT","STO","444839","Two Tier Dish Drainer Red","Benross","H38 x W48 x D25cm","Red","1",NA,NA,0.95
