"PSA_1","PSA_2","Article","Web Description","Brand","Size","Colour","Pack Qty","Material","DQ Score"
"HOM","BAT","293767","Croydex Secura Safe Shower Spray Set White","Croydex","Single",NA,"1",NA,1
"HOM","BAT","310507","Wilko Toothbrush Holder Macau Collection ChromeEffect","Croydex","Single","Silver","1",NA,0.95
"HOM","BAT","347937","Croydex Bath Mat","Croydex",NA,"White",NA,NA,0.825
"HOM","BAT","423312","Croydex Sparkle Toilet Seat","Croydex","34cm x 42cm",NA,"1","Resin",0.941666666666667
"HOM","BAT","423313","Croydex Rust Free Shower Caddy","Croydex",NA,NA,"1",NA,0.9125
"HOM","BAT","423314","Croydex Foster Sit Tight Toilet Seat White","Croydex",NA,NA,"1",NA,0.825
"HOM","BAT","452659","Croydex Toilet Seat White Sparkle","Croydex","44x37x5cm",NA,"1","Resin, Zinc",0.941666666666667
"HOM","BAT","452660","Croydex Telescopic Stick n Lock Rod","Croydex","5x117cm",NA,"1",NA,1
"HOM","BAT","452661","Croydex Corner Basket Rust Free","Croydex","16.5x28x6cm",NA,"1","Rust Free Mild Steel",0.941666666666667
