"PSA_1","PSA_2","Article","Web Description","Brand","Size","Colour","Pack Qty","Age","DQ Score"
"SBK","GIF","410972","Disney Frozen Roll Wrap 4m","Disney Frozen","4m x 69cm","Multi","1",NA,0.941666666666667
"TOI","ACB","452979","Disney Frozen Bath and Shower Bubbles","Disney Frozen",NA,NA,"1",NA,0.9125
"TOY","FAN","408630","Disney Frozen Twirling Baton","Disney Frozen",NA,"Multi","1","3 Years +",0.941666666666667
"TOY","FAN","440509","Disney Frozen Fashems","Disney Frozen",NA,"Multi","1","3 Years +",0.9
"TOY","FAN","443801","Disney Frozen Walkie Talkies","Disney Frozen",NA,"Multi","2","3 Years +",0.9
"TOY","FAN","448276","Disney Frozen Doll Assorted","Disney Frozen",NA,"Multi","1","3 Years +",0.9
