"PSA_1","PSA_2","Article","Web Description","Brand","Size","Colour","Pack Qty","Assembly","Coverage","DQ Score"
"PAI","ICI","99629","Dulux Natural Hints Silk Emulsion PaintJasmine White 2.5L","Dulux","2.5L","White",NA,NA,"32m²",0.941666666666667
"PAI","WAP","139827","Dulux Silk Emulsion PaintPure Brilliant White 5L","Dulux","5L","White",NA,NA,NA,0.883333333333333
"PAI","WAP","139828","Dulux Matt Emulsion Paint Pure Brilliant White 5ltr","Dulux","5L","White",NA,NA,"76m²",0.941666666666667
"PAI","WAP","231065","Dulux Matt Emulsion PaintPure Brilliant White 2.5L","Dulux","2.5l","White","1",NA,"32m²",1
"PAI","WAP","231084","Dulux Bathroom+ Soft Sheen Emulsion PaintPure Brilliant White 2.5L","Dulux","2.5L","White",NA,NA,"35m²",0.941666666666667
"PAI","WAP","340557","Dulux Primer and Undercoat Multi Surface PaintWhite 750ml","Dulux","750ml","White","1","No",NA,0.65
"PAI","WAP","449382","Dulux Easycare Matt Emulsion Paint Pure BrilliantWhite 2.5L","Dulux","2.5L","White","1",NA,"13 sq m per litre",1
"PAI","WAP","65253","Dulux Matt Emulsion PaintPure Brilliant White 2.5L","Dulux","2.5L","White","1",NA,"32m²",1
"PAI","WAP","65255","Dulux Silk Emulsion PaintPure Brilliant White 2.5L","Dulux","2.5L","White","1",NA,"32m²",1
