"PSA_1","PSA_2","Article","Web Description","Brand","Size","Colour","Pack Qty","Assembly","Coverage","DQ Score"
"PAI","EXT","346530","Dulux Weathershield Exterior Satin PaintPure Brilliant White 750ml","Dulux","750ml","White",NA,NA,NA,0.883333333333333
"PAI","EXT","449404","Dulux Weathershield Multisurface Paint PureBrilliant White 750ml","Dulux","750ml","White","1",NA,"10sq m per litre",1
"PAI","GLO","126260","Dulux Non Drip Gloss PaintBlack 750ml","Dulux","750ml","Black","1","No","9m²",0.65
"PAI","GLO","190866","Dulux Once Satinwood PaintPure Brilliant White 2.5L","Dulux","2.5L","White","1","No","30m²",0.65
"PAI","GLO","2224040","Dulux Professional UndercoatPure Brilliant White 2.5L","Dulux","2.5L","White","1","No","40m²",0.65
"PAI","GLO","2228240","Dulux Liquid Gloss PaintPure Brilliant White 2.5L","Dulux","2.5L","White","1","No","45m²",0.65
"PAI","GLO","257993","Dulux Once Satinwood PaintPure Brilliant White 750ml","Dulux","750ml","White",NA,"No","9m²",0.65
"PAI","GLO","257995","Dulux Once Gloss PaintPure Brilliant White 750ml","Dulux","750ml","White",NA,"No","8m²",0.65
"PAI","GLO","332476","Dulux Quick Dry Satinwood PaintAlmond White 750ml","Dulux","750ml","White",NA,"No","12m2",0.65
"PAI","GLO","332481","Dulux Quick Dry Satinwood PaintNatural Hessian 750ml","Dulux","750ml","Cream",NA,"No","12m2",0.65
"PAI","GLO","332483","Dulux Quick Dry Satinwood PaintTimeless 750ml","Dulux","750ml","Cream",NA,"No","12m2",0.65
"PAI","GLO","332484","Dulux Quick Dry Satinwood PaintWhite Cotton 750ml","Dulux","750ml","White",NA,"No","12m2",0.65
"PAI","GLO","340962","Dulux Quick Dry Gloss PaintPure Brilliant White 750ml","Dulux","750ml","White","1","No","12sq m",0.65
"PAI","GLO","340963","Dulux Quick Dry Gloss PaintPure Brilliant White 2.5L","Dulux","2.5L","White","1","No","40sq m",0.65
"PAI","GLO","344361","Dulux Quick Dry Eggshell PaintPure Brilliant White 750ml","Dulux","750ml","White","1","No",NA,0.65
"PAI","GLO","344363","Dulux Quick Dry Gloss PaintMagnolia 750ml","Dulux","750ml","Cream",NA,"No",NA,0.65
"PAI","GLO","344365","Dulux Quick Dry Satinwood PaintPure Brilliant White 2.5L","Dulux","2.5L","White",NA,"No",NA,0.65
"PAI","GLO","344366","Dulux Quick Dry Satinwood PaintPure Brilliant White 750ml","Dulux","750ml","White",NA,"No",NA,0.65
"PAI","GLO","49015","Dulux Once Gloss PaintPure Brilliant White 2.5L","Dulux","2.5L","White","1","No","27mandsup2;",0.65
"PAI","GLO","7449","Dulux Non Drip Gloss PaintPure Brilliant White 2.5L","Dulux","2.5L","White",NA,"No","30m²",0.65
"PAI","GLO","99700","Dulux Gloss Liquid Pure Brilliant White 750ml","Dulux","750ml","White",NA,"No","14m²",0.65
"PAI","GLO","99701","Dulux Non Drip Gloss PaintPure Brilliant White 750ml","Dulux","750ml","White","1","No","9m²",0.65
"PAI","GLO","99702","Dulux Professional UndercoatPure Brilliant White 750ml","Dulux","750ml","White","1","No","24m²",0.65
"PAI","ICI","148615","Dulux Silk Emulsion PaintViolet White 2.5L","Dulux","2.5L","White","1",NA,"32m²",1
"PAI","ICI","148618","Dulux Silk Emulsion PaintJade White 2.5L","Dulux","2.5L","White",NA,NA,"32m²",0.941666666666667
"PAI","ICI","148625","Dulux Silk Emulsion PaintIvory 2.5L","Dulux","2.5L","Cream","1",NA,"32m²",1
"PAI","ICI","166435","Dulux Silk Emulsion PaintBlue Babe 2.5L","Dulux","2.5L","Blue",NA,NA,"32m²",0.941666666666667
"PAI","ICI","166442","Dulux Silk Emulsion PaintLemon Tropics 2.5L","Dulux","2.5L","Yellow",NA,NA,"32m²",0.941666666666667
"PAI","ICI","166460","Dulux Silk Emulsion PaintCalico 2.5L","Dulux","2.5L","White","1",NA,"32m²",1
"PAI","ICI","166461","Dulux Silk Emulsion PaintNatural Hessian 2.5L","Dulux","2.5L","Brown",NA,NA,"32m²",0.941666666666667
"PAI","ICI","166468","Dulux Silk Emulsion PaintNatural Wicker 2.5L","Dulux","2.5L","Wood",NA,NA,"32m²",0.941666666666667
"PAI","ICI","166471","Dulux Matt Emulsion PaintBlue Babe 2.5L","Dulux","2.5L","Blue",NA,NA,"32m²",0.941666666666667
"PAI","ICI","166492","Dulux Matt Emulsion PaintCalico 2.5L","Dulux","2.5L","White",NA,NA,"32m²",0.941666666666667
"PAI","ICI","166493","Dulux Matt Emulsion PaintNatural Hessian 2.5L","Dulux","2.5L","Brown",NA,NA,"32m²",0.941666666666667
"PAI","ICI","166508","Dulux Matt Emulsion PaintWicker 2.5L","Dulux","2.5L","Cream",NA,NA,"32m²",0.941666666666667
"PAI","ICI","166516","Dulux Natural Hints Matt Emulsion PaintApple White 2.5L","Dulux","2.5L","White","1",NA,"32m²",1
"PAI","ICI","166523","Dulux Natural Hints Matt Emulsion PaintJasmine White 2.5L","Dulux","2.5L","White",NA,NA,"32m²",0.941666666666667
"PAI","ICI","166526","Dulux Natural Hints Matt Emulsion PaintBlossom White 2.5L","Dulux","2.5L","White",NA,NA,"32m²",0.941666666666667
"PAI","ICI","166528","Dulux Natural Hints Matt Emulsion PaintAlmond White 2.5L","Dulux","2.5L","White","1",NA,"32m²",1
"PAI","ICI","166530","Dulux Natural Hints Matt Emulsion PaintViolet White 2.5L","Dulux","2.5L","White",NA,NA,"32m²",0.941666666666667
"PAI","ICI","166532","Dulux Natural Hints Matt Emulsion PaintCornflower White 2.5L","Dulux","2.5L","White","1",NA,"32m²",1
"PAI","ICI","166533","Dulux Matt Emulsion PaintJade White 2.5L","Dulux","2.5L","White","1",NA,"32m²",1
"PAI","ICI","186687","Dulux Matt Emulsion Paint Tester PotAlmond White 50ml","Dulux","50ml","White","1",NA,NA,0.941666666666667
"PAI","ICI","186688","Dulux Matt Emulsion Paint Tester PotApple White 50ml","Dulux","50ml","White",NA,NA,NA,0.883333333333333
"PAI","ICI","186701","Dulux Matt Emulsion Paint Tester PotBlossom White 50ml","Dulux","50ml","White","1",NA,NA,0.941666666666667
"PAI","ICI","186704","Dulux Matt Emulsion Paint Tester PotBlue Babe 50ml","Dulux","50ml","Blue",NA,NA,NA,0.883333333333333
"PAI","ICI","186717","Dulux Matt Emulsion Paint Tester PotButtermilk 50ml","Dulux","50ml","Cream","1",NA,NA,0.941666666666667
"PAI","ICI","186720","Dulux Matt Emulsion Paint Tester PotCornflower White 50ml","Dulux","50ml","White",NA,NA,NA,0.883333333333333
"PAI","ICI","186725","Dulux Matt Emulsion Paint Tester PotIvory 50ml","Dulux","50ml","Cream",NA,NA,NA,0.883333333333333
"PAI","ICI","186726","Dulux Matt Emulsion Paint Tester PotJade White 50ml","Dulux","50ml","White",NA,NA,NA,0.883333333333333
"PAI","ICI","186727","Dulux Matt Emulsion Paint Tester PotJasmine White 50ml","Dulux","50ml","White",NA,NA,NA,0.883333333333333
"PAI","ICI","186729","Dulux Matt Emulsion Paint Tester PotLemon Tropics 50ml","Dulux","50ml","Yellow",NA,NA,NA,0.883333333333333
"PAI","ICI","186731","Dulux Matt Emulsion Paint Tester PotMagnolia 50ml","Dulux","50ml","Cream",NA,NA,NA,0.883333333333333
"PAI","ICI","186734","Dulux Matt Emulsion Paint Tester PotNatural Calico 50ml","Dulux","50ml","White",NA,NA,NA,0.883333333333333
"PAI","ICI","186737","Dulux Matt Emulsion Paint Tester PotNatural Hessian 50ml","Dulux","50ml","Brown",NA,NA,NA,0.883333333333333
"PAI","ICI","186744","Dulux Matt Emulsion Paint Tester PotNatural Wicker 50ml","Dulux","50ml","Wood",NA,NA,NA,0.883333333333333
"PAI","ICI","186774","Dulux Matt Emulsion Paint Tester PotSoft Peach 50ml","Dulux","50ml","Orange",NA,NA,NA,0.883333333333333
"PAI","ICI","186785","Dulux Matt Emulsion Paint Tester PotViolet 50ml","Dulux","50ml","White",NA,NA,NA,0.883333333333333
"PAI","ICI","190562","Dulux Matt Emulsion PaintIvory Lace 2.5L","Dulux","2.5L","Yellow",NA,NA,"32m²",0.941666666666667
"PAI","ICI","190563","Dulux Matt Emulsion PaintApricot Crush 2.5L","Dulux","2.5L","Orange",NA,NA,"32m²",0.941666666666667
"PAI","ICI","190566","Dulux Matt Emulsion PaintWillow Tree 2.5L","Dulux","2.5L","Green",NA,NA,"32m²",0.941666666666667
"PAI","ICI","190574","Dulux Matt Emulsion PaintRoasted Red 2.5L","Dulux","2.5L","Red",NA,NA,"32m²",0.941666666666667
"PAI","ICI","190579","Dulux Matt Emulsion PaintEgyptian Cotton 2.5L","Dulux","2.5L","White",NA,NA,"32m²",0.941666666666667
"PAI","ICI","190584","Dulux Matt Emulsion PaintTimeless 2.5L","Dulux","2.5L","White",NA,NA,"32m²",0.941666666666667
"PAI","ICI","190586","Dulux Matt Emulsion PaintWellbeing 2.5L","Dulux","2.5L","Green","1",NA,"32m²",1
"PAI","ICI","190591","Dulux Matt Emulsion PaintFirst Dawn 2.5L","Dulux","2.5L","Blue",NA,NA,"32m²",0.941666666666667
"PAI","ICI","190594","Dulux Silk Emulsion PaintIvory Lace 2.5L","Dulux","2.5L","Yellow","1",NA,"32m²",1
"PAI","ICI","190596","Dulux Silk Emulsion PaintApricot Crush 2.5L","Dulux","2.5L","Orange","1",NA,"32m²",1
"PAI","ICI","190597","Dulux Silk Emulsion PaintWillow Tree 2.5L","Dulux","2.5L","Green",NA,NA,"32m²",0.941666666666667
"PAI","ICI","190600","Dulux Silk Emulsion PaintRoasted Red 2.5L","Dulux","2.5L","Red",NA,NA,"32m²",0.941666666666667
"PAI","ICI","190604","Dulux Silk Emulsion PaintEgyptian Cotton 2.5L","Dulux","2.5L","White",NA,NA,"32m²",0.941666666666667
"PAI","ICI","190608","Dulux Silk Emulsion PaintTimeless 2.5L","Dulux","2.5L","White","1",NA,"32m²",1
"PAI","ICI","190609","Dulux Silk Emulsion PaintWellbeing 2.5L","Dulux","2.5L","Green","1",NA,"32m²",1
"PAI","ICI","190612","Dulux Silk Emulsion PaintFirst Dawn 2.5L","Dulux","2.5L","Blue",NA,NA,"32m²",0.941666666666667
"PAI","ICI","190687","Dulux Matt Emulsion Paint Tester PotIvory Lace 50ml","Dulux","50ml","Yellow",NA,NA,NA,0.883333333333333
"PAI","ICI","190698","Dulux Matt Emulsion Paint Tester PotApricot Crush 50ml","Dulux","50ml","Orange",NA,NA,NA,0.883333333333333
"PAI","ICI","190711","Dulux Matt Emulsion Paint Tester PotEgyptian Cotton 50ml","Dulux","50ml","White","1",NA,NA,0.941666666666667
"PAI","ICI","190714","Dulux Matt Emulsion Paint Tester PotFirst Dawn 50ml","Dulux","50ml","Blue",NA,NA,NA,0.883333333333333
"PAI","ICI","190733","Dulux Matt Emulsion Paint Tester PotRoasted Red 50ml","Dulux","50ml","Red",NA,NA,NA,0.883333333333333
"PAI","ICI","190736","Dulux Matt Emulsion Paint Tester PotTimeless 50ml","Dulux","50ml","White",NA,NA,NA,0.883333333333333
"PAI","ICI","190747","Dulux Matt Emulsion Paint Tester PotWellbeing 50ml","Dulux","50ml","Green","1",NA,NA,0.941666666666667
"PAI","ICI","205863","Dulux Matt Emulsion Paint Tester PotGentle Fawn 50ml","Dulux","50ml","Brown",NA,NA,NA,0.883333333333333
"PAI","ICI","205907","Dulux Silk Emulsion PaintGentle Fawn 2.5L","Dulux","2.5L","Brown","1",NA,"32m²",1
"PAI","ICI","212357","Dulux Matt Emulsion PaintGentle Lavender 2.5L","Dulux","2.5L","Purple",NA,NA,"32m²",0.941666666666667
"PAI","ICI","212363","Dulux Silk Emulsion PaintMineral Mist 2.5L","Dulux","2.5L","Blue",NA,NA,"32m²",0.941666666666667
"PAI","ICI","212366","Dulux Matt Emulsion PaintPretty Pink 2.5L","Dulux","2.5L","Pink",NA,NA,"32m²",0.941666666666667
"PAI","ICI","212367","Dulux Silk Emulsion PaintPretty Pink 2.5L","Dulux","2.5L","Pink",NA,NA,"32m²",0.941666666666667
"PAI","ICI","212368","Dulux Matt Emulsion PaintPutting Green 2.5L","Dulux","2.5L","Green",NA,NA,"32m²",0.941666666666667
"PAI","ICI","212369","Dulux Silk Emulsion PaintPutting Green 2.5L","Dulux","2.5L","Green","1",NA,"32m²",1
"PAI","ICI","212374","Dulux Matt Emulsion PaintSoft Apple 2.5L","Dulux","2.5L","Green",NA,NA,"32m²",0.941666666666667
"PAI","ICI","212376","Dulux Matt Emulsion PaintSoft Stone 2.5L","Dulux","2.5L","Cream","1",NA,"32m²",1
"PAI","ICI","212378","Dulux Silk Emulsion PaintSoft Stone 2.5L","Dulux","2.5L","Cream","1",NA,"32m²",1
"PAI","ICI","212433","Dulux Matt Emulsion Paint Tester PotLavender 50ml","Dulux","50ml","Purple",NA,NA,NA,0.883333333333333
"PAI","ICI","212436","Dulux Matt Emulsion Paint Tester PotMineral Mist 50ml","Dulux","50ml","Blue",NA,NA,NA,0.883333333333333
"PAI","ICI","212438","Dulux Matt Emulsion Paint Tester PotPretty Pink 50ml","Dulux","50ml","Pink","1",NA,NA,0.941666666666667
"PAI","ICI","212439","Dulux Matt Emulsion Paint Tester PotPutting Green 50ml","Dulux","50ml","Green",NA,NA,NA,0.883333333333333
"PAI","ICI","212442","Dulux Matt Emulsion Paint Tester PotSoft Apple 50ml","Dulux","50ml","Green",NA,NA,NA,0.883333333333333
"PAI","ICI","212443","Dulux Matt Emulsion Paint Tester PotSoft Stone 50ml","Dulux","50ml","Cream",NA,NA,NA,0.883333333333333
"PAI","ICI","2232560","Dulux Matt Emulsion PaintButtermilk 2.5L","Dulux","2.5L","Cream",NA,NA,"32m²",0.941666666666667
"PAI","ICI","2232743","Dulux Matt Emulsion PaintMagnolia 2.5L","Dulux","2.5L","Brown",NA,NA,"32m²",0.941666666666667
"PAI","ICI","2236860","Dulux Silk Emulsion PaintButtermilk 2.5L","Dulux","2.5L","Cream","1",NA,"32m²",1
"PAI","ICI","2237043","Dulux Silk Emulsion PaintMagnolia 2.5L","Dulux","2.5L","Cream",NA,NA,"32m²",0.941666666666667
"PAI","ICI","2237149","Dulux Silk Emulsion PaintSoft Peach 2.5L","Dulux","2.5L","Orange",NA,NA,"32m²",0.941666666666667
"PAI","ICI","2251642","Dulux Natural Hints Emulsion Apple White 2.5L","Dulux","2.5L","White",NA,NA,"32m²",0.941666666666667
"PAI","ICI","230916","Dulux Matt Emulsion PaintCookie Dough 2.5L","Dulux","2.5L","Brown",NA,NA,"32m²",0.941666666666667
"PAI","ICI","241678","Dulux Matt Emulsion Paint Tester PotMellow Mocha 50ml","Dulux","50ml","Brown",NA,NA,NA,0.883333333333333
"PAI","ICI","241684","Dulux Matt Emulsion Paint Tester PotSoft Truffle 50ml","Dulux","50ml","Cream",NA,NA,NA,0.883333333333333
"PAI","ICI","241696","Dulux Matt Emulsion PaintMellow Mocha 2.5L","Dulux","2.5L","Brown",NA,NA,"32m²",0.941666666666667
"PAI","ICI","241702","Dulux Matt Emulsion PaintSoft Truffle 2.5L","Dulux","2.5L","Brown",NA,NA,"32m²",0.941666666666667
"PAI","ICI","241737","Dulux Silk Emulsion PaintAlmost Oyster 2.5L","Dulux","2.5L","Cream","1",NA,"32m²",1
"PAI","ICI","241740","Dulux Silk Emulsion PaintMellow Mocha 2.5L","Dulux","2.5L","Brown",NA,NA,"32m²",0.941666666666667
"PAI","ICI","241746","Dulux Silk Emulsion PaintSoft Truffle 2.5L","Dulux","2.5L","Cream",NA,NA,"32m²",0.941666666666667
"PAI","ICI","252860","Dulux Matt Emulsion PaintWhite Mist 2.5L","Dulux","2.5L","White","1",NA,"32m²",1
"PAI","ICI","252861","Dulux Matt Emulsion PaintWhite Cotton 2.5L","Dulux","2.5L","White","1",NA,"32m²",1
"PAI","ICI","252866","Dulux Silk Emulsion PaintWhite Mist 2.5L","Dulux","2.5L","White",NA,NA,"32m²",0.941666666666667
"PAI","ICI","252867","Dulux Silk Emulsion PaintWhite Cotton 2.5L","Dulux","2.5L","White",NA,NA,"32m²",0.941666666666667
"PAI","ICI","252872","Dulux Matt Emulsion Paint Tester PotWhite Mist 50ml","Dulux","50ml","White",NA,NA,NA,0.883333333333333
"PAI","ICI","252873","Dulux Matt Emulsion Paint Tester PotWhite Cotton 50ml","Dulux","50ml","White",NA,NA,NA,0.883333333333333
"PAI","ICI","264041","Dulux Silk Emulsion PaintMuddy Puddle 2.5L","Dulux","2.5L","Brown",NA,NA,"32m²",0.941666666666667
"PAI","ICI","264051","Dulux Matt Emulsion Paint Tester PotMuddy Puddle 50ml","Dulux","50ml","Brown",NA,NA,NA,0.883333333333333
"PAI","ICI","275749","Dulux Matt Emulsion PaintDusted Fondant 2.5L","Dulux","2.5L","Purple",NA,NA,"32m²",0.941666666666667
"PAI","ICI","275756","Dulux Silk Emulsion PaintDusted Fondant 2.5L","Dulux","2.5L","Purple",NA,NA,"32m²",0.941666666666667
"PAI","ICI","275763","Dulux Matt Emulsion Paint Tester PotDusted Fondant 50ml","Dulux","50ml","Purple",NA,NA,NA,0.883333333333333
"PAI","ICI","288841","Dulux Matt Emulsion Paint Tester PotWillow Tree 50ml","Dulux","50ml","Green",NA,NA,NA,0.883333333333333
"PAI","ICI","298485","Dulux Matt Emulsion PaintChic Shadow 2.5L","Dulux","2.5L","Cream",NA,NA,"32m²",0.941666666666667
"PAI","ICI","298486","Dulux Matt Emulsion PaintPolished Pebble 2.5L","Dulux","2.5L","Grey",NA,NA,"32m²",0.941666666666667
"PAI","ICI","298487","Dulux Matt Emulsion PaintNutmeg White 2.5L","Dulux","2.5L","White",NA,NA,"32m²",0.941666666666667
"PAI","ICI","298488","Dulux Silk Emulsion PaintChic Shadow 2.5L","Dulux","2.5L","Cream",NA,NA,"32m²",0.941666666666667
"PAI","ICI","298489","Dulux Silk Emulsion PaintPolished Pebble 2.5L","Dulux","2.5L","Grey",NA,NA,"32m²",0.941666666666667
"PAI","ICI","298490","Dulux Silk Emulsion PaintNutmeg White 2.5L","Dulux","2.5L","White","1",NA,"32m²",1
"PAI","ICI","298613","Dulux Matt Emulsion Paint Tester PotChic Shadow 50ml","Dulux","50ml","Cream",NA,NA,NA,0.883333333333333
"PAI","ICI","298614","Dulux Matt Emulsion Paint Tester PotPolished Pebble 50ml","Dulux","50ml","Grey",NA,NA,NA,0.883333333333333
"PAI","ICI","298615","Dulux Matt Emulsion Paint Tester PotNutmeg White 50ml","Dulux","50ml","White",NA,NA,NA,0.883333333333333
"PAI","ICI","315569","Dulux Silk Emulsion PaintRich Black 2.5L","Dulux","2.5L","Black",NA,NA,"32m²",0.941666666666667
"PAI","ICI","315571","Dulux Matt Emulsion PaintRich Black 2.5L","Dulux","2.5L","Black",NA,NA,"32m²",0.941666666666667
"PAI","ICI","332073","Dulux Matt Emulsion PaintCrispy Crumble 2.5L","Dulux","2.5L","Cream",NA,NA,"32m²",0.941666666666667
"PAI","ICI","332078","Dulux Matt Emulsion PaintWarm Pewter 2.5L","Dulux","2.5L","Cream",NA,NA,"32m²",0.941666666666667
"PAI","ICI","332081","Dulux Silk Emulsion PaintCrispy Crumble 2.5L","Dulux","2.5L","Cream","1",NA,"32m²",1
"PAI","ICI","332424","Dulux Silk Emulsion PaintWarm Pewter 2.5L","Dulux","2.5L","Cream","1",NA,"32m²",1
"PAI","ICI","332432","Dulux Matt Emulsion Paint Tester PotCrispy Crumble 50ml","Dulux","50ml","Cream",NA,NA,NA,0.883333333333333
"PAI","ICI","332437","Dulux Matt Emulsion Paint Tester PotWarm Pewter 50ml","Dulux","50ml","Cream",NA,NA,NA,0.883333333333333
"PAI","ICI","340572","Dulux Bathroom+ Soft Sheen Emulsion PaintChic Shadow 2.5L","Dulux","2.5L","Cream","1",NA,NA,0.941666666666667
"PAI","ICI","340574","Dulux Bathroom+ Soft Sheen Emulsion PaintFrosted Steel 2.5L","Dulux","2.5L","Metal",NA,NA,NA,0.883333333333333
"PAI","ICI","340821","Dulux Bathroom+ Soft Sheen Emulsion PaintMarine Splash 2.5L","Dulux","2.5L","Green","1",NA,NA,0.941666666666667
"PAI","ICI","341264","Dulux Bathroom+ Soft Sheen Emulsion PaintTester Pot Marine Splash 50ml","Dulux","50ml","Green",NA,NA,NA,0.883333333333333
"PAI","ICI","341378","Dulux Bathroom+ Soft Sheen Emulsion PaintJasmine White 2.5L","Dulux","2.5L","White","1",NA,NA,0.941666666666667
"PAI","ICI","341379","Dulux Bathroom+ Soft Sheen Emulsion PaintMagnolia 2.5L","Dulux","2.5L","Cream","1",NA,NA,0.941666666666667
"PAI","ICI","341381","Dulux Bathroom+ Soft Sheen Emulsion PaintMineral Mist 2.5L","Dulux","2.5L","Blue","1",NA,NA,0.941666666666667
"PAI","ICI","341382","Dulux Bathroom+ Soft Sheen Emulsion PaintNatural Hessian 2.5L","Dulux","2.5L","Brown",NA,NA,NA,0.883333333333333
"PAI","ICI","341383","Dulux Bathroom+ Soft Sheen Emulsion PaintNatural Calico 2.5L","Dulux","2.5L","Brown",NA,NA,NA,0.883333333333333
"PAI","ICI","341384","Dulux Bathroom+ Soft Sheen Emulsion PaintTester Pot Frosted Steel 50ml","Dulux","50ml","Metal","1",NA,NA,0.941666666666667
"PAI","ICI","341387","Dulux Bathroom+ Soft Sheen Emulsion PaintTester Pot Jasmine White 50ml","Dulux","50ml","White",NA,NA,NA,0.883333333333333
"PAI","ICI","341389","Dulux Bathroom+ Soft Sheen Emulsion PaintTester Pot Mineral Mist 50ml","Dulux","50ml","Blue","1",NA,NA,0.941666666666667
"PAI","ICI","341391","Dulux Bathroom+ Soft Sheen Emulsion PaintTester Pot Natural Hessian 50ml","Dulux","50ml","Brown",NA,NA,NA,0.883333333333333
"PAI","ICI","341392","Dulux Bathroom+ Soft Sheen Emulsion PaintTester Pot Natural Calico 50ml","Dulux","50ml","Brown","1",NA,NA,0.941666666666667
"PAI","ICI","341393","Dulux Kitchen+ Matt Emulsion PaintFrosted Steel 2.5L","Dulux","2.5L","Metal",NA,NA,NA,0.883333333333333
"PAI","ICI","341395","Dulux Kitchen+ Matt Emulsion PaintJasmine White 2.5L","Dulux","2.5L","White","1",NA,NA,0.941666666666667
"PAI","ICI","341396","Dulux Kitchen+ Matt Emulsion PaintLuscious Lime 2.5L","Dulux","2.5L","Green","1",NA,NA,0.941666666666667
"PAI","ICI","341397","Dulux Kitchen+ Matt Emulsion PaintMagnolia 2.5L","Dulux","2.5L","Cream","1",NA,NA,0.941666666666667
"PAI","ICI","341438","Dulux Kitchen+ Matt Emulsion PaintNatural Calico 2.5L","Dulux","2.5L","Brown","1",NA,NA,0.941666666666667
"PAI","ICI","341439","Dulux Kitchen+ Matt Emulsion PaintNatural Hessian 2.5L","Dulux","2.5L","Brown",NA,NA,NA,0.883333333333333
"PAI","ICI","341440","Dulux Kitchen+ Matt Emulsion PaintOvertly Olive 2.5L","Dulux","2.5L","Green",NA,NA,NA,0.883333333333333
"PAI","ICI","341447","Dulux Kitchen+ Matt Emulsion PaintSoft Vanilla 2.5L","Dulux","2.5L","Cream",NA,NA,NA,0.883333333333333
"PAI","ICI","341448","Dulux Kitchen+ Matt Emulsion PaintWillow Tree 2.5L","Dulux","2.5L","Green",NA,NA,NA,0.883333333333333
"PAI","ICI","341450","Dulux Kitchen+ Matt Emulsion Paint Tester PotFrosted Steel 50ml","Dulux","50ml","Metal",NA,NA,NA,0.883333333333333
"PAI","ICI","341466","Dulux Kitchen+ Matt Emulsion Paint Tester PotMagnolia 50ml","Dulux","50ml","Cream",NA,NA,NA,0.883333333333333
"PAI","ICI","341470","Dulux Kitchen+ Matt Emulsion Paint Tester PotNatural Hessian 50ml","Dulux","50ml","Brown",NA,NA,NA,0.883333333333333
"PAI","ICI","341534","Dulux Kitchen+ Matt Emulsion Paint Tester PotSoft Vanilla 50ml","Dulux","50ml","Cream",NA,NA,NA,0.883333333333333
"PAI","ICI","341535","Dulux Kitchen+ Matt Emulsion Paint Tester PotWillow Tree 50ml","Dulux","50ml","Green",NA,NA,NA,0.883333333333333
"PAI","ICI","434256","Dulux Endurance+ Matt Emulsion Paint Tester PotPepper Red 50ml","Dulux","50ml","Red","1",NA,NA,0.941666666666667
"PAI","ICI","434257","Dulux Bathroom+ Soft Sheen Emulsion PaintTester Pot Blissful Blue 50ml","Dulux","50ml","Blue","1",NA,NA,0.941666666666667
"PAI","ICI","434260","Dulux Endurance+ Matt Emulsion Paint Tester PotCopper Blush 50ml","Dulux","50ml","Orange","1",NA,NA,0.941666666666667
"PAI","ICI","434261","Dulux Endurance+ Matt Emulsion Paint Tester PotGoose Down 50ml","Dulux","50ml","Grey","1",NA,NA,0.941666666666667
"PAI","ICI","434262","Dulux Endurance+ Matt Emulsion Paint Tester PotLavender Quartz 50ml","Dulux","50ml","Purple","1",NA,NA,0.941666666666667
"PAI","ICI","434265","Dulux Endurance+ Matt Emulsion Paint Tester PotRock Salt 50ml","Dulux","50ml","Grey","1",NA,NA,0.941666666666667
"PAI","ICI","434267","Dulux Matt Emulsion PaintBlue Opal 2.5L","Dulux","2.5L","Blue","1",NA,"13sm per litre",1
"PAI","ICI","434269","Dulux Matt Emulsion PaintGoose Down 2.5L","Dulux","2.5L","Grey","1",NA,"13sm per litre",1
"PAI","ICI","434271","Dulux Matt Emulsion PaintMuted Sage 2.5L","Dulux","2.5L","Green","1",NA,"13sm per litre",1
"PAI","ICI","434272","Dulux Matt Emulsion PaintNordic Sky 2.5L","Dulux","2.5L","Blue","1",NA,"13sm per litre",1
"PAI","ICI","434273","Dulux Matt Emulsion PaintRock Salt 2.5L","Dulux","2.5L","Grey","1",NA,"13sm per litre",1
"PAI","ICI","434274","Dulux Matt Emulsion PaintSummer Linen 2.5L","Dulux","2.5L","Cream","1",NA,"13sm per litre",1
"PAI","ICI","434277","Dulux Silk Emulsion PaintGoose Down 2.5L","Dulux","2.5L","Grey","1",NA,"13sm per litre",1
"PAI","ICI","434279","Dulux Silk Emulsion PaintMuted Sage 2.5L","Dulux","2.5L","Green","1",NA,"13sm per litre",1
"PAI","ICI","434280","Dulux Silk Emulsion PaintNordic Sky 2.5L","Dulux","2.5L","Blue","1",NA,"13sm per litre",1
"PAI","ICI","434281","Dulux Silk Emulsion PaintRock Salt 2.5L","Dulux","2.5L","Grey","1",NA,"13sm per litre",1
"PAI","ICI","434282","Dulux Silk Emulsion PaintSummer Linen 2.5L","Dulux","2.5L","Cream","1",NA,"13sm per litre",1
"PAI","ICI","434293","Dulux Kitchen+ Matt Emulsion PaintPepper Red 2.5L","Dulux","2.5L","Red","1",NA,"13sm per litre",1
"PAI","ICI","434295","Dulux Bathroom+ Soft Sheen Emulsion PaintRock Salt 2.5L","Dulux","2.5L","Grey","1",NA,"13sm per litre",1
"PAI","ICI","449373","Dulux Easycare Matt Emulsion Paint Timeless 2.5L","Dulux","2.5L","White","1",NA,"13 sq m per litre",0.95
"PAI","ICI","449374","Dulux Easycare Matt Emulsion Paint Blush Pink 2.5L","Dulux","2.5L","Pink","1",NA,"13 sq m per litre",0.95
"PAI","ICI","449375","Dulux Easycare Matt Emulsion Paint Chic Shadow2.5L","Dulux","2.5L","Grey","1",NA,"13 sq m per litre",0.95
"PAI","ICI","449376","Dulux Easycare Matt Emulsion Paint Denim Drift2.5L","Dulux","2.5L","Blue","1",NA,"13 sq m per litre",1
"PAI","ICI","449377","Dulux Easycare Matt Emulsion Paint Egyptian Cotton2.5L","Dulux","2.5L","Cream","1",NA,"13 sq m per litre",0.95
"PAI","ICI","449379","Dulux Easycare Matt Emulsion Paint Magnolia 2.5L","Dulux","2.5L","Cream","1",NA,"13 sq m per litre",0.95
"PAI","ICI","449380","Dulux Easycare Matt Emulsion Paint Natural Hessian2.5L","Dulux","2.5L","Cream","1",NA,"13 sq m per litre",1
"PAI","ICI","449381","Dulux Easycare Matt Emulsion Paint Natural Calico2.5L","Dulux","2.5L","Cream","1",NA,"13 sq m per litre",1
"PAI","ICI","449383","Dulux Easycare Matt Emulsion Paint Polished Pebble2.5L","Dulux","2.5L","Grey","1",NA,"13 sq m per litre",1
"PAI","ICI","449384","Dulux Easycare Matt Emulsion Tester Pot PolishedPebble 50ml","Dulux","50ml","Grey","1",NA,"13 sq m per litre",1
"PAI","ICI","449385","Dulux Easycare Matt Emulsion Tester Pot Timeless50ml","Dulux","50ml","White","1",NA,"13 sq m per litre",1
"PAI","ICI","449386","Dulux Easycare Matt Emulsion Tester Pot Blush Pink50ml","Dulux","50ml","Pink","1",NA,"13 sq m per litre",1
"PAI","ICI","449387","Dulux Easycare Matt Emulsion Tester Pot ChicShadow 50ml","Dulux","50ml","Grey","1",NA,"13 sq m per litre",1
"PAI","ICI","449388","Dulux Easycare Matt Emulsion Tester Pot DenimDrift 50ml","Dulux","50ml","Blue","1",NA,"13 sq m per litre",1
"PAI","ICI","449389","Dulux Easycare Matt Emulsion Tester Pot EgyptianCotton 50ml","Dulux","50ml","Cream","1",NA,"13 sq m per litre",1
"PAI","ICI","449390","Dulux Easycare Matt Emulsion Tester Pot Mineral MMist 50ml","Dulux","50ml","White","1",NA,"13 sq m per litre",1
"PAI","ICI","449391","Dulux Easycare Matt Emulsion Tester Pot Magnolia50ml","Dulux","50ml","Cream","1",NA,"13 sq m per litre",1
"PAI","ICI","449392","Dulux Easycare Matt Emulsion Tester Pot NaturalHessian 50ml","Dulux","50ml","Cream","1",NA,"13 sq m per litre",1
"PAI","ICI","449393","Dulux Easycare Tester Natural Calico 50ml","Dulux","50ml","Cream","1",NA,"13 sq m per litre",1
"PAI","ICI","71496","Dulux Natural Hints Silk Emulsion PaintBlossom White 2.5L","Dulux","2.5L","White",NA,NA,"32m²",0.941666666666667
"PAI","ICI","71498","Dulux Silk Emulsion PaintCornflower White 2.5L","Dulux","2.5L","White",NA,NA,"32m²",0.941666666666667
"PAI","ICI","9856","Dulux Natural Hints Silk Emulsion PaintAlmond White 2.5L","Dulux","2.5L","White",NA,NA,"32m²",0.941666666666667
