"PSA_1","PSA_2","Article","Web Description","Brand","Size","Pack Qty","DQ Score"
"PET","100","314433","King British Green Water Control Pond Water Treatment 250ml","King British",NA,NA,1
"PET","100","314435","King British White Spot Control Pond Fish Medicine250ml","King British",NA,NA,1
"PET","100","314437","King British Sludge Remover Pond Water Treatment 250ml","King British",NA,NA,1
"PET","100","335691","King British Barley Straw Extract 250ml","King British",NA,NA,1
"PET","DOM","303722","King British Aquarium Alfgae Wafers 40g","King British","40g",NA,0.86
"PET","DOM","303723","King British Aquarium Fish Pellets 65g","King British","65g","1",0.93
"PET","DOM","303724","King British Aquarium 6 in 1 Water Test Strips150pk","King British",NA,NA,0.79
