"PSA_1","PSA_2","Article","Web Description","Brand","Size","Colour","Pack Qty","Age","DQ Score"
"PET","TRT","454020","Scooby Snacks Dog Treat Adult","Scooby Doo","100g",NA,"1",NA,0.95
"PET","TRT","454021","Scooby Snacks Dog Treat Puppy","Scooby Doo","100g",NA,"1",NA,0.95
"PET","TRT","454022","Scooby Doo Activity Ball","Scooby Doo","Small",NA,"1",NA,1
"TOY","ACT","428060","Scooby Doo Figure In Goo Assortment","Scooby Doo",NA,"Multi","1","3 Years +",0.941666666666667
"TOY","ACT","428062","Scooby Doo Super Soft Plush","Scooby Doo",NA,"Multi","1","From Birth",0.9
"TOY","ACT","448340","Scooby Doo Vehicle and Figure Assortment","Scooby Doo",NA,"Multi","1","3 Years +",0.941666666666667
