"Article","Web Description","Brand","Type","Pack Qty","Size","DQ Score"
"453870","Cif Actifizz Spray Ocean 450ml","Cif","Multi-Purpose Cleaner","1","450ml",1
"412311","Cillit Bang Power Cleaner Degreaser 750ml","Cillit Bang","Kitchen Cleaners","1","750ml",1
"418129","Hob Brite Cream 250ml","Hob Brite","Kitchen Cleaners","1","250ml",1
"136418","Mr Muscle Sink and Plug 500ml","Mr Muscle","Sink and Drain Unblockers","1","500ml",1
"218572","Oven Pride Complete Oven Cleaner 500ml","Oven Pride","Oven Cleaner","1","500ml",1
"224088","Homecare Shiny Sinks 290ml","Shiny Sinks","Kitchen Cleaners","1","290ml",1
