"Article","Web Description","Brand","Type","Colour","Pack Qty","Size","DQ Score"
"314958","Sydeco Fiesta Bush Assorted","Sydeco","Artificial Plants and Grass",NA,"1",NA,0.86
"314961","Sydeco Sea Grass Baby","Sydeco","Artificial Plants and Grass",NA,"1",NA,0.86
"417672","Wilko Aquarium Plant Assorted Colours Small","Wilko","Artificial Plants and Grass",NA,NA,NA,0.79
"417673","Wilko Aquarium Plant Assorted Colours and DesignsMedium","Wilko","Artificial Plants and Grass",NA,NA,NA,0.79
"417674","Wilko Aquarium Plant Assorted Designs and ColoursLarge","Wilko","Artificial Plants and Grass",NA,NA,NA,0.79
