"Article","Web Description","Brand","Type","Colour","Pack Qty","Size","DQ Score"
"430311","Wilko Medium Gift Bag Pink and Blue","Wilko","Gift Bag",NA,"1","25.4cm x 21.5cm x 10cm",0.93
"430312","Wilko Medium Gift Bag White and Silver","Wilko","Gift Bag",NA,"1","25.4cm x 21.5cm x 10cm",0.93
"430313","Wilko Dotted Gift Bag Medium","Wilko","Gift Bag",NA,"1","25.4cm x 21.5cm x 10cm",0.93
"430314","Wilko Spot Gift Bag Small Blue","Wilko","Gift Bag",NA,"1","14.8cm x 12.7cm x 90cm",0.93
"430315","Wilko Foil Spot Bottle Bag Assorted","Wilko","Gift Bag",NA,"1","35.4cm x 12.5cm x 90cm",0.93
"430316","Wilko Photographic Rose Gift Bag Large","Wilko","Gift Bag",NA,"1","26.5cm x 33cm x 135cm",0.93
"430317","Wilko Floral With Love Gift Bag Medium","Wilko","Gift Bag",NA,"1","25.4cm x 21.5cm x 10cm",0.93
"430332","Wilko Craft Spot Gift Bag Medium Blue","Wilko","Gift Bag",NA,"1","25.4cm x 21.5cm x 10cm",0.93
