"Article","Web Description","Brand","Type","Colour","Pack Qty","Size","DQ Score"
"352090","Minky Easy Breeze 4 Arm Rotary Airer 45m","Minky","Outdoor Airer","Multi","1","45m",1
"229129","Wilko Radiator Airer 3pk","Wilko","Indoor Airer","White","3pk","18x57cm",1
"285491","Wilko Zipped Rotary Airer Cover Green 176 x 30cm","Wilko","Rotary Covers","Multi","1","176cm x 30cm",1
"328545","Wilko Indoor Balcony Clothes Airer 12m","Wilko","Indoor Airer","Silver","1","12m",1
"56804","Wilko Radiator Airer White 4 Bar","Wilko","Indoor Airer","White","1","34.5x61cm",1
