"Article","Web Description","Brand","Type","Pack Qty","Size","DQ Score"
"303685","Beaphar Small Animal Cage Fresh Granules 600g","Beaphar","Healthcare",NA,"600g",0.9125
"303686","Beaphar Small Animal Anti-Parasite Spot On 4pk","Beaphar","Healthcare",NA,NA,0.825
"303656","Wilko Small Animal Litter Pan","Wilko","Litter Trays","1",NA,0.9125
"303661","Wilko Small Animal Claw Trimmers","Wilko","Healthcare","1",NA,0.9125
"438565","Wilko Small Animal Grooming Kit 2pk","Wilko","Grooming Kit","2",NA,0.9125
