"Article","Web Description","Brand","Type","Colour","Power","Pack Qty","Washable","Age","Size","Material","DQ Score"
"280281","Barbie Fashion Doll Assorted","Barbie","Dolls","Multi",NA,"1",NA,"3 Years +",NA,NA,0.9
"401809","Barbie Beach Ken","Barbie","Dolls","Multi",NA,"1",NA,"3 Years +",NA,NA,0.9
"448537","Barbie Fashionista Doll Assorted","Barbie","Dolls","Multi",NA,"1","Wipe Clean Only","3 Years +",NA,NA,0.95
"448539","Barbie Fashion Dresses Assortment","Barbie","Doll Accessories","Multi",NA,"1","Wipe Clean Only","3 Years +",NA,NA,0.95
"448231","Beados Refill Pack","Beados","Beads and Jewels","Multi",NA,"1",NA,"3 Years +",NA,NA,0.9
"448233","Beados Four Colour Pen","Beados","Beads and Jewels","Multi",NA,"1",NA,"5 Years +",NA,NA,0.941666666666667
"448342","Bunchems Bugs Bestioles Creation Pack","Bunchems","Craft Kits","Multi",NA,"1",NA,"3 Years +",NA,NA,0.941666666666667
"448401","Bunchems Colour Booster Creation Pack","Bunchems","Craft Kits","Multi",NA,"1",NA,"6 Years +",NA,NA,0.941666666666667
"443823","Chicco Ranger Dolls Pram Junior Collection Pink","Chicco Capri","Pram",NA,NA,"1",NA,"3 Years +",NA,NA,0.8
"452666","Cupcake Surprise Doll","Cupcake Surprise","Dolls","Multi",NA,"1",NA,"3 Years +",NA,NA,0.9
"345055","Disney Princess Bath Doll Assorted","Disney","Dolls","Multi",NA,"1",NA,"3 Years +",NA,NA,0.9
"408611","Palace Pets Furry Tail Friends Assortment","Disney","Figures","Multi",NA,"1",NA,"3 Years +",NA,NA,0.85
"428516","Disney Princess Classic Fashion Doll Assorted","Disney","Dolls","Multi",NA,"1",NA,"3 Years +",NA,NA,0.9
"439450","Disney Cinderella Twirling Skirt Doll","Disney","Dolls","Multi",NA,"1",NA,"3 Years +",NA,NA,0.9
"439633","Disney Princess Microphone","Disney","Singing Microphone","Multi",NA,"1",NA,"3 Years +",NA,NA,0.9
"447531","Disney Princess Light Up Ball","Disney","Play Balls","Multi",NA,"1",NA,"3 Years +",NA,NA,0.9
"449840","Disney Princess Small Doll Assorted","Disney","Dolls","Multi",NA,"1",NA,"3 Years +",NA,NA,0.9
"408630","Disney Frozen Twirling Baton","Disney Frozen","Baton","Multi",NA,"1",NA,"3 Years +",NA,NA,0.941666666666667
"440509","Disney Frozen Fashems","Disney Frozen","Collectables","Multi",NA,"1",NA,"3 Years +",NA,NA,0.9
"443801","Disney Frozen Walkie Talkies","Disney Frozen","Walkie Talkies","Multi",NA,"2",NA,"3 Years +",NA,NA,0.9
"448276","Disney Frozen Doll Assorted","Disney Frozen","Dolls","Multi",NA,"1",NA,"3 Years +",NA,NA,0.9
"456434","Hatchimals Colleggtible Blind Egg","Hatchimals","Hatchimals","Multi",NA,"1",NA,"5 Years +",NA,NA,0.85
"456436","Hatchimals Colleggtible and Bonus Egg 4pk","Hatchimals","Hatchimals","Multi",NA,"4",NA,"5+",NA,NA,0.85
"440187","Lalaloopsy Babies Doll Asst","Lalaloopsy","Dolls","Multi",NA,"1",NA,"3 Years +",NA,NA,0.9
"408613","Little Live Pets Bird Pack Assortment","Little Live Pets","Collectables","Multi",NA,"1",NA,"5 Years +",NA,NA,0.9
"439912","Little Live Pets Turtle Assortment","Little Live Pets","Collectables","Multi",NA,"1",NA,"3 Years +",NA,NA,0.9
"448243","Little Live Pets Baby Chick","Little Live Pets","Figure Playsets","Multi",NA,"1",NA,"5 Years +",NA,NA,0.9
"450777","Little Live Pets Tweet Talking Bird Cage","Little Live Pets","Figure Playsets","Multi",NA,"1",NA,"5 Years +",NA,NA,0.9
"417884","Monster High Zombie Shake 2pk","Monster High","Dolls","Multi",NA,"2",NA,"6 Years +",NA,NA,0.9
"417886","Monster High Frights Camera Action Assortment","Monster High","Dolls","Multi",NA,"1",NA,"6 Years +",NA,NA,0.9
"439423","Monster High Art Class Doll Asst","Monster High","Dolls","Multi",NA,"1",NA,"6 Years +",NA,NA,0.9
"417888","My Little Pony Scribble Me Assortment","My Little Pony","Soft Toys","Multi",NA,"1",NA,"3 Years +",NA,NA,0.9
"440507","My Little Pony Fashems","My Little Pony","Collectables","Multi",NA,"1",NA,"3 Years +",NA,NA,0.9
"448193","My Little Pony Movie Character Figure","My Little Pony","Collectables","Multi",NA,"1",NA,"3 Years +",NA,NA,0.9
"448277","My Little Pony Blind Bag","My Little Pony","Collectables","Multi",NA,"1",NA,"3 Years +",NA,NA,0.9
"438670","Pony Cycle Ride On Toy","Pony Cycle","Pony Cycle","Multi",NA,"1",NA,"3 Years +",NA,NA,0.9
"428006","Shopkins 5pk","Shopkins","Figure Playsets","Multi",NA,"5","Wipe Clean Only","5 Years +",NA,NA,0.9
"428007","Shopkins Deluxe Pack Asst","Shopkins","Figure Playsets","Multi",NA,"1","Wipe Clean Only","5 Years +",NA,NA,0.95
"428008","Shopkins Shoppies Doll Asst","Shopkins","Dolls","Multi",NA,"1","Wipe Clean Only","5 Years +",NA,NA,0.95
"448259","Shopkins 12pk","Shopkins","Collectables","Multi",NA,"1",NA,"5 Years +",NA,NA,0.9
"320602","Sparkle Girlz Winter Fairy Doll Assortment","Sparkle Girls","Dolls","Multi",NA,"1",NA,"3 Years +",NA,NA,0.85
"335994","Sparkle Girlz Little Fairy Doll Assortment","Sparkle Girls","Dolls","Multi",NA,"1",NA,"3 Years +",NA,NA,0.85
"438454","Sparkle Girlz Princess Doll Pony Carriage","Sparkle Girls","Dolls","Multi",NA,"1",NA,"3 Years +",NA,NA,0.85
"438459","Sparkle Girlz Winter Doll Large","Sparkle Girls","Dolls","Multi",NA,"1",NA,"3 Years +",NA,NA,0.85
"439980","Star Wars Small Projector","Star Wars","Projector","Multi",NA,"1",NA,"3 Years +",NA,NA,0.941666666666667
"440594","Trolls Small Blind Bag","Trolls","Collectables","Multi",NA,"1",NA,"5 Years +",NA,NA,0.85
"439880","Tsum Tsum Twin Pack","Tsum Tsum","Collectables",NA,NA,"2",NA,NA,NA,NA,0.8625
"447525","Disney Tsum Tsum Christmas Tin","Tsum Tsum","Collectables","Multi",NA,"1",NA,"3 Years +",NA,NA,0.85
"280431","Wilko Little Baby Doll","Wilko","Dolls","Multi",NA,"1",NA,"12 Months +",NA,NA,0.9
"305678","Wilko Dress Up Doll","Wilko","Dolls","Multi",NA,"1","Do Not Wash","3 Years +",NA,NA,0.95
"320670","Wilko Baby Doll Nappies 5pk","Wilko","Doll Accessories","White",NA,"5","Do Not Wash","3 Years +",NA,NA,0.95
"320671","Wilko Baby Doll Outfits 4pk","Wilko","Doll Accessories","Multi",NA,"4","Do Not Wash","3 Years +",NA,NA,0.95
"320673","Wilko Newborn Changing Bag","Wilko","Doll Accessories","Multi",NA,"1",NA,"3 Years +",NA,NA,0.9
"335998","Wilko Let's Pretend Princess Doll Assortment","Wilko","Dolls","Multi",NA,"1",NA,"3 Years +",NA,NA,0.9
"336012","Wilko Time For Tea Doll","Wilko","Dolls","Multi",NA,"1","Do Not Wash","3 Years +",NA,NA,0.95
"350590","Wilko Baby Doll Carrier","Wilko","Doll Accessories","Multi",NA,"1","Hand Wash Only","3 Years +",NA,NA,0.95
"417311","Wilko Play Princess Doll and Horse with GroomingAccessories","Wilko","Dolls","Multi",NA,"1",NA,"3 Years +",NA,NA,0.9
"417312","Wilko Play Princess Dolls 5pk Assortment","Wilko","Dolls","Multi",NA,"5",NA,"3 Years +",NA,NA,0.9
"417383","Wilko Story Tales Knitted Gingerbread Man Doll","Wilko","Dolls","Multi",NA,"1",NA,"From Birth",NA,NA,0.9
"417385","Wilko Story Tales Goldilocks Rag Doll","Wilko","Dolls","Multi",NA,"1",NA,"From Birth",NA,NA,0.9
"417386","Wilko Storytales Red Riding Hood Ragdoll","Wilko","Dolls","Multi",NA,"1",NA,"From Birth",NA,NA,0.9
"419463","Wilko Let's Cuddle Doll","Wilko","Dolls","Multi",NA,"1",NA,"3 Years +",NA,NA,0.9
"419487","Wilko Play Mobile Home with Accessories","Wilko","Figure Playsets","Multi","2x AAA Batteries Included","1",NA,"3 Years +",NA,NA,0.95
"419488","Wilko Play Doll Pushchair","Wilko","Doll Accessories","Multi",NA,"1",NA,"3 Years +",NA,NA,0.9
"438453","Wilko Set of 10 Mini Dolls","Wilko","Dolls","Multi",NA,"10",NA,"3 Years +",NA,NA,0.9
"438559","Wilko Play Hairdressing Kit","Wilko","Play Dress Up","Multi",NA,"1",NA,NA,NA,NA,0.93
"438560","Wilko Feeding Time Baby Doll Boxed","Wilko","Dolls","Multi",NA,"1",NA,"2 Years +",NA,NA,0.9
"438660","Wilko Baby Bath Time Set","Wilko","Doll Accessories","Multi",NA,"1",NA,"2+ Years",NA,NA,0.9
"438662","Wilko Potty And Bottle Set","Wilko","Doll Accessories","Multi",NA,"1",NA,"3 Years +",NA,NA,0.9
"438663","Wilko Twin Dolls","Wilko","Dolls","Multi",NA,"1",NA,"2 Years +",NA,NA,0.9
"438664","Wilko Milk and Juice Magic Feeding Bottles","Wilko","Doll Accessories","Multi",NA,"1",NA,"3 Years +",NA,NA,0.9
"456223","Wilko Magic Bottle with Feeding Set","Wilko","Doll Accessories","Multi",NA,"1",NA,"2 Years +",NA,NA,0.9
"456224","Wilko Splash About Baby Doll","Wilko","Dolls","Multi",NA,"1",NA,"18 Months +",NA,NA,0.9
"456471","Wilko Doll Bed, High Chair and Swing Set","Wilko","Doll Accessories","Multi",NA,"1",NA,"3 Years +",NA,NA,0.9
"456474","Wilko Baby Accessories with Bag 50pcs","Wilko","Doll Accessories","Multi",NA,"1",NA,"3 Years +",NA,NA,0.9
"456503","Wilko Dolls Fashion Outfit Single","Wilko","Doll Accessories","Multi",NA,"1","Hand Wash Only","3 Years +",NA,NA,0.95
"456504","Wilko Dolls Fashion Outfit Set","Wilko","Doll Accessories","Multi",NA,"4","Hand Wash Only","3 Years +",NA,NA,0.95
"456532","Wilko Royal Breeds Equestrian Challenge","Wilko","Figure Playsets","Multi",NA,"1",NA,"3 Years +",NA,NA,0.941666666666667
"456533","Wilko Royal Breeds Build a Stable","Wilko","Figure Playsets","Multi",NA,"1",NA,"3 Years +",NA,NA,0.941666666666667
"456534","Wilko Royal Breeds Pretty Grooming Assorted","Wilko","Figure Playsets","Multi",NA,"1",NA,"3 Years +",NA,NA,0.941666666666667
"456607","Wilko Single Doll Outfit","Wilko","Doll Accessories","Multi",NA,"1",NA,"3 Years +",NA,NA,0.9
"456608","Wilko Talking Softie Baby Doll","Wilko","Dolls","Multi",NA,"1","Do Not Wash","12 Months +",NA,NA,0.95
"456609","Wilko Potty Time Doll","Wilko","Dolls","Multi",NA,"1","Do Not Wash","3 Years +",NA,NA,0.95
"456611","Wilko Princess Styling Head","Wilko","Dolls","Multi",NA,"1","Do Not Wash","3 Years +",NA,NA,0.95
