"Article","Web Description","Brand","Type","Colour","Pack Qty","Size","DQ Score"
"272578","Ariel Washing Gel Bio 16 Washes 592ml","Ariel","Liquid and Gel Detergents",NA,"1","592ml",1
"278061","Ariel Washing Gel Bio 24 Washes 888ml","Ariel","Liquid and Gel Detergents",NA,"1","888ml",1
"278062","Ariel Washing Gel Febreze 24 Washes 888ml","Ariel","Liquid and Gel Detergents",NA,"1","888ml",1
"278067","Ariel Washing Gel Colour 24 Washes 888ml","Ariel","Liquid and Gel Detergents",NA,"1","888ml",1
"333378","Ariel 3in1 Bio Liquid Tablets 19 Washes","Ariel","Liquitabs",NA,"19s","19s",1
"333379","Ariel 3in1 Tablets Colour and Style 19 Washes","Ariel","Liquitabs",NA,"19s","19s",1
"333380","Ariel 3 in 1 Liquid Tablets Febreze 19 Washes","Ariel","Liquitabs",NA,"19s","19s",1
"351261","Ariel Washing Liquid Original 22 Washes 1.2L","Ariel","Liquid and Gel Detergents",NA,"1","1.2L",1
"351264","Ariel Washing Liquid Original 40 Washes 2L","Ariel","Liquid and Gel Detergents",NA,"1","2L",1
"454183","Ariel Liquid Regular 3L","Ariel","Liquid and Gel Detergents",NA,"1","3L",1
"295254","Bold Gel With Lenor Lotus Flower and Lilly 888ml","Bold","Liquid and Gel Detergents",NA,"1","888ml",1
"295341","Bold Gel With Lenor Lavender and Camomile 888ml","Bold","Liquid and Gel Detergents",NA,"1","888ml",1
"330301","Bold Gel With Lenor Sparkling Bloom and YellowPoppy 24 Washes 888ml","Bold","Liquid and Gel Detergents",NA,"1","888ml",1
"351270","Bold 2in1 Liquid Lavender and Camomile 1.9L","Bold","Liquid and Gel Detergents",NA,"1","1.9L",1
"432518","Bold 2in1 with Lenor Sparkling Bloom andYellow Poppy 1.2L","Bold","Liquid and Gel Detergents",NA,"1","1.2L",1
"432522","Bold 2in1 Powder Sparkling Bloom 1.43kg","Bold","Washing powder",NA,"1","1.43kg",1
"168862","Calgon Water Softener 15pk","Calgon","Water Softener",NA,"1","218g",1
"275078","Calgon 2 in 1 Water Softener Powder 600g","Calgon","Water Softener",NA,"1","600g",1
"177822","Comfort Vaporesse Ironing Water 1L","Comfort","Ironing Water",NA,"1","1L",1
"255077","Comfort Sunshiny Days Fabric Conditioner 42Washes 1.5L","Comfort","Fabric Conditioners",NA,"1","1.5L",1
"255079","Comfort Pure Fabric Conditioner 42 Washes 1.5L","Comfort","Fabric Conditioners",NA,"1","1.5L",1
"332317","Comfort Blue Skies Fabric Conditioner 85 Washes 3L","Comfort","Fabric Conditioners",NA,"1","3L",1
"334443","Comfort Pure Fabric Conditioner 3L","Comfort","Fabric Conditioners",NA,"1","3L",1
"352863","Comfort Creations Honeysuckle and Sandalwood1.16L","Comfort","Fabric Conditioners",NA,"1","1.16L",1
"409225","Comfort Creations Fabric Conditioner CherryBlossom and Sweet Pea 1.16L","Comfort","Liquid and Gel Detergents",NA,"1","1.16L",1
"430856","Comfort Pure Fabric Conditioner 570ml","Comfort","Fabric Conditioners",NA,"1","570ml",1
"439876","Comfort Intense Luxurious 960ml","Comfort","Fabric Conditioners",NA,"1","960ml",1
"350030","Daz Detergent Powder   Regular 2.6kg","Daz","Washing Powder",NA,"1","2.6kg",1
"350031","Daz Detergent  Powder  Regular 1.43kg","Daz","Washing Powder",NA,"1","1.43kg",1
"450760","Daz Liquid 2.45L","Daz","Liquid and Gel Detergents",NA,"1","2.45L",1
"414377","Dettol Wash Machine Cleaner Gel 250ml","Dettol","Washing Machine Cleaner",NA,"1","250ml",1
"95059","Dr Beckmann Glowhite Super Whitener 5pk","Dr Beckmann","Stain and Pre-Treatment Agents",NA,"1","5x40g",1
"228002","Dylon Wash and Dye Velvet Black 350g","Dylon","Fabric Dyes","Black","1","350g",1
"270596","Dylon Fabric Dye Intense Violet 50g","Dylon","Clothing Dye","Purple","1","50g",1
"274482","Dylon Colour Catcher Sheets 24pk","Dylon","Stain and Pre-Treatment Agents",NA,"1","24 Sheets",1
"285879","Dylon Dye Salt 500g","Dylon","Clothing Dye","Cream","1","500g",1
"332023","Dylon Spray Starch Aerosol Spray 300ml","Dylon","Spray Starch",NA,"1","300ml",1
"454085","Dylon Dye Pod Navy Blue 350g","Dylon","Fabric Dyes ","Blue","1","350g",1
"454086","Dylon Dye Pod Forest Green 350g","Dylon","Fabric Dyes ","Green","1","350g",1
"454087","Dylon Dye Pod Intense Black 350g","Dylon","Fabric Dyes ","Black","1","350g",1
"454088","Dylon Dye Pod Jeans Blue 350g","Dylon","Fabric Dyes","Blue","1","350g",1
"454089","Dylon Dye Pod Tulip Red 350g","Dylon","Fabric Dyes ","Red","1","350g",1
"454090","Dylon Dye Pod Deep Violet 350g","Dylon","Fabric Dyes ","Purple","1","350g",1
"454091","Dylon Dye Pod Ocean Blue","Dylon","Fabric Dyes ","Blue","1","350g",1
"454092","Dylon Dye Pod Passion Pink 350g","Dylon","Fabric Dyes ","Pink","1","350g",1
"454093","Dylon Dye Pod Fresh Orange 350g","Dylon","Fabric Dyes","Orange","1","350g",1
"454094","Dylon Dye Pod Espresso Brown 350g","Dylon","Fabric Dyes ","Brown","1","350g",1
"454095","Dylon Dye Pod Sunflower Yellow 350g","Dylon","Fabric Dyes","Yellow","1","350g",1
"454096","Dylon Dye Pod Sandy Beige 350g","Dylon","Fabric Dyes ","Brown","1","350g",1
"454097","Dylon Dye Pod Plum Red","Dylon","Fabric Dyes ","Red","1","350g",1
"454098","Dylon Dye Pod Olive Green 350g","Dylon","Fabric Dyes ","Green","1","350g",1
"454099","Dylon Dye Pod Paradise Blue 350g","Dylon","Fabric Dyes ","Blue","1","350g",1
"454100","Dylon Dye Pod Emerald Green 350g","Dylon","Fabric Dyes ","Green","1","350g",1
"454101","Dylon Dye Pod Vintage Blue 350g","Dylon","Fabric Dyes ","Blue","1","350g",1
"454102","Dylon Dye Pod Smoke Grey 350g","Dylon","Fabric Dyes","Grey","1","350g",1
"454104","Dylon Dye Pod Peony Pink 350g","Dylon","Fabric Dyes ","Pink","1","350g",1
"316180","Fairy Gel Non Bio 24 Washes 888ml","Fairy","Liquid and Gel Detergents",NA,"1","888ml",1
"350034","Fairy Non Bio Regular Detergent Powder 1.43kg","Fairy","Washing Powder",NA,"1","1.43kg",1
"441966","Fairy Original Fabric Conditioner 2.905L","Fairy","Fabric Conditioners",NA,"1","2.905L",1
"297018","Febreze Fabric Freshener Lavender 500ml","Febreze","Fabric Fresheners",NA,"1","500ml",1
"400324","Lenor Unstoppables Fresh 375g","Lenor","Fabric Fresheners",NA,"1","375g",1
"400325","Lenor Unstoppables Lavish 375g","Lenor","Fabric Fresheners",NA,"1","375g",1
"400341","Lenor Fabric Conditioner Fresh Meadow 44 Washes1.1L","Lenor","Fabric Conditioners",NA,"1","1.1L",1
"400344","Lenor Fabric Conditioner Ocean Escape 37 Washes925ml","Lenor","Fabric Conditioners",NA,"1","925ml",1
"422363","Lenor Unstoppables Uplift 275g","Lenor","Fabric Fresheners",NA,"1","275g",1
"428910","Lenor Gold Orchid Fabric Conditioner 1.8L","Lenor","Fabric Conditioners",NA,"1","1.8L",1
"428911","Lenor Ocean Escape Fabric Conditioner 1.8L","Lenor","Fabric Conditioners",NA,"1","1.8L",1
"432514","Lenor Unstoppables Spring 375g","Lenor","Fabric Fresheners",NA,"1","375g",1
"338144","Persil Small and Mighty Washing LiquidColour Protect 770ml","Persil","Liquid and Gel Detergents",NA,"1","770ml",1
"351784","Persil Colour Protect Washing Powder1.61kg","Persil","Washing Powder",NA,"1","23 Washes",1
"351785","Persil Non-Bio Washing Powder1.61kg","Persil","Washing Powder",NA,"1","23 Washes",1
"434075","Persil Bio Capsules 22 Washes","Persil","Liquitabs",NA,"1","22 tabs",1
"434079","Persil Non Bio Capsules 22 Washes","Persil","Liquitabs",NA,"1","22 tabs",1
"434092","Persil Colour Protect Capsules 22 Washes","Persil","Liquitabs",NA,"1","22 tabs",1
"434094","Persil Powder Non Bio 45 Washes","Persil","Washing Powder",NA,"1","3.185kg",1
"434071","Surf Bio Capsules Tropical Lily and Ylang Ylang33 Washes","Surf","Liquitabs",NA,"1","33 tabs",1
"434096","Surf Bio Herbal Extract 33 Washes","Surf","Liquitabs",NA,"1","33 tabs",1
"206458","Vanish Oxi Action Stain Remover 500g","Vanish","Stain and Pre-Treatment Agents",NA,"1","500g",1
"243084","Vanish Oxi Action Crystal White Fabric StainRemover 500g","Vanish","Stain and Pre-Treatment Agents",NA,"1","500g",1
"347226","Vanish Pre Treat Stain Remover Gel 200ml","Vanish","Stain and Pre-Treatment Agents",NA,"1","200ml",1
"347229","Vanish Gold Oxi Stain Remover  470g","Vanish","Stain and Pre-Treatment Agents",NA,"1","470g",1
"411870","Vanish White Gold Stain Remover 470g","Vanish","Stain and Pre-Treatment Agents",NA,"1","470g",1
"411871","Vanish White Gold Stain Remover 940g","Vanish","Stain and Pre-Treatment Agents",NA,"1","940g",1
"454173","Vanish White Platinum Powder 470g","Vanish","Stain and Pre-Treatment Agents ",NA,"1","470g",1
"454174","Vanish Pink Platinum Powder 470g","Vanish","Stain and Pre-Treatment Agents",NA,"1","470g",1
"454176","Vanish Pink Platinum Gel 940ml","Vanish","Stain and Pre-Treatment Agents ",NA,"1","940ml",1
"454177","Vanish White Platinum Gel 940ml","Vanish","Stain and Pre-Treatment Agents",NA,"1","940ml",1
"454178","Vanish Gold Oxi Action Stain Remover Gel 940ml","Vanish","Stain and Pre-Treatment Agents",NA,"1","940ml",1
"203195","Wilko Laundry Water Softening 15pk","Wilko","Water Softener",NA,"15","225g",1
"332009","Wilko Original Citric Acid 250g","Wilko","Limescale Remover",NA,NA,NA,1
"412410","Wilko Original Liquid Soapflakes 750ml","Wilko","Liquid and Gel Detergents",NA,NA,NA,1
"432770","Wilko Bio Liquid Tabs 18 Washes","Wilko","Liquitabs",NA,"18","18 tabs",1
"432771","Wilko Non Bio Liquid Tabs 18 Washes","Wilko","Liquitabs",NA,"18","18 tabs",1
"432773","Wilko Bio Liquid Detergent Eucalyptus Leaf andWhite Rose 1L","Wilko","Liquid and Gel Detergents",NA,"1","1L",1
"432774","Wilko Non Bio Liquid Detergent White Lily andFresh Apple 1L","Wilko","Liquid and Gel Detergents",NA,"1","1L",1
"432775","Wilko Fragrance Boost Exotic Ylang andFressia 480g","Wilko","Fabric Fresheners",NA,"1","400g",1
"433035","Wilko Colour Collector 10pk","Wilko","Stain and Pre-Treatment Agents",NA,"10","Colour Collectors, 3.5(l)x12(w)x16(h)",1
"433454","Wilko Fabric Conditioner Exotic Ylang andFressia 22 Washes 750ml","Wilko","Fabric Conditioners",NA,"1","750ml",1
"433455","Wilko Fabric Conditioner Blue Fressia andMagnolia Champaca 750ml","Wilko","Fabric Conditioners",NA,"1","750ml",1
"433563","Wilko Ironing Water Exotic Ylang andFressia 1L","Wilko","Ironing Water",NA,"1","1L",1
"438813","Wilko Fabric Freshener Exotic Ylang andFreesia 750ml","Wilko","Fabric Fresheners",NA,"1","750ml",1
"454106","Wilko Fragrance Boost Rose & Cherry 480g","Wilko","Fabric Fresheners",NA,"1","480g",1
"454107","Wilko Ironing Water Rose & Cherry 1L","Wilko","Ironing Water",NA,"1","1L",1
"454108","Wilko Antibacterial Laundry Cleanser White CottonFleur 1L","Wilko","Laundry Cleanser",NA,"1","1L",1
"454109","Wilko Bio Gel Detergent Eucalyptus Leaf and WhiteRose 770ml","Wilko","Liquid and Gel Detergents",NA,"1","770ml",1
"454110","Wilko Non Bio Gel Detergent White Lily and FreshApple 770ml","Wilko","Liquid and Gel Detergents",NA,"1","770ml",1
"454144","Wilko Concentrated Fabric Conditioner MidnightIris and Amethyst 945ml","Wilko","Fabric Conditioners",NA,"1","954ml",1
"454145","Wilko Premium Fabric Conditioner Rose & Cherry954ml","Wilko","Fabric Conditioners",NA,"1","954ml",1
"454146","Wilko Skin Kind Fabric Conditioner Silk Pashmina750ml","Wilko","Fabric Conditioners",NA,"1","750ml",1
"454271","Wilko Fabric Conditioner Blue Skies 1.5L","Wilko","Fabric Conditioners",NA,"1","1.5L",1
"454272","Wilko Fabric Conditioner Sunny Day 1.5L","Wilko","Fabric Conditioners",NA,"1","1.5L",1
"275080","Woolite Detergent Hand and Machine Wash 750ml","Woolite","Delicate Wash",NA,"1","750ml",1
