"Article","Web Description","Brand","Type","Colour","Pack Qty","Size","DQ Score"
"442212","Jerome Russell Maximum Colour Toner Silver","Jerome Russell","Toner",NA,"1",NA,0.81
"442213","Jerome Russell Maximum Colour Toner Steel","Jerome Russell","Toner",NA,"1",NA,0.86
"444980","L'Oreal Magic Retouch Dark Blonde Root Touch Up","L'Oreal","Root Retouch",NA,"1",NA,0.86
"450015","L'Oreal Magic Retouch Light Golden Blonde RootTouch Up","L'Oreal","Root Retouch",NA,"1",NA,0.86
"451104","Root Perfect Blonde 75ml","Root Perfect","Root Retouch",NA,"1","75ml",0.93
"452129","Schwarzkopf Color Expert Hair ColourantLight Cool Blonde 10.2","Schwarzkopf","Permanent",NA,"1",NA,0.86
"452139","Schwarzkopf Color Expert Hair ColourantDark Blonde 7.0","Schwarzkopf","Permanent",NA,"1",NA,0.86
"452900","Schwarzkopf Ultra Brights Hair ColourantSteel Silver","Schwarzkopf","Semi-Permanent",NA,"1",NA,0.86
